연번,지적사항,주요내용(요약),처분요구
5,"이사회 운영 부적정 ◦ ｢ 사립학교법 ｣ 제 15 조 제 4 항 및 제 17 조 제 3 항에 따르면 이사장은 이사회를 소집하고 그 의장이 되며 , 이사회를 소집할 때에는 적어도 회의 7 일 전에 회의의 목적을 명시하여 각 이사에게 통지하여야 하고 ,","- 학교법인 인산교육재단은 2017. 9. 8. “ 징계 결의 및 징계위원회 위원 선출 건 ” 심의를 위한 2017 년 제 6 차 이사회를 소집하면서 회의 6 일 전인 2017. 9. 1. ( 법정통지 기한 : 2017. 8. 31.) 통지하는 등 【 붙임 1】“ 이사회 소집 통지기한 미준수 현황 ” 과 같이 2017. 9. 1. 부터 2019. 2. 19. 까지 이사회를 소집하면서 총 3 회 이사회 소집 6 일 전에 통지한 사실이 있고 , 【 이사회 소집 미통지 안건 심의 · 의결에 관한 사항 】- ② - 2017. 6. 27. 2017 년 제 4 차 이사회에서 이...","【 붙임 1】 이사회 소집 통지기한 미준수 현황 연번 이사회 의결 안건 비고 회차 개최일 법정통지 기한 통지일 ( 시점 ) 1 2017 년 6 차 2017.9.8. 2017.8.31. 2017.9.1. 1. 징계 결의 및 징계위원회 위원 선출의 건 2 2018 년 2 차 2018.2.27. 2018.2.19. 2018.2.20. 1. 교원 인사 ( 안 ) 심의의 건 2. 교원 임용의 건 3. 2018 학년도 학칙 및 학칙시행세칙 개정의 건 4. 2017 학년도 교비회계 3 차 추가경정예산 ( 안 ) 심의의 건 5. 정관 개정의 건 3 2019 년 2 차 2019.2.26. 2019.2.18. 2019.2.19. 교원 신규임용 ( 안 ) 심의의 건 【 붙임 2】 이사회 소집 미통지 안건 심의 ‧ 의결 현황 연번 이사회 통지 안건 미통지 안건 심의 · 의결 현황 비고 회차 개최일 통지일 ( 시점 ) 1 2017 년 4 차 2017.6.27. 2017.6.19. 1. 교원 임용의 건 1. 대학 차량운반구 구입의 건 2. 불용재산 제각 심의의 건 2 2017 년 7 차 2017.10.31. 2017.10.19. 1. 2017 학년도 교비회계 제 2 차 추가경정예산 ( 안 ) 심의의 건 2. 개방이사 ( 감사 ) 추천위원회 위원 선임 ( 보선 ) 의 건 1. 정관 개정의 건 2. 대학 교목 신규채용 건 3 2018 년 2 차 2018.2.27. 2018.2.20. 1. 교원 인사 ( 안 ) 심의의 건 2. 정관 개정의 건 1. 교원 임용의 건 2. 2018 학년도 학칙 및 학칙시행 세칙 개정의 건 3. 2017 학 년 도 교 비 회 계 3 차 추가경정예산 ( 안 ) 심의의 건 4 2018 년 3 차 2018.4.20. 2018.4.10. 1. 2017 학년도 법인회계 결산 심의의 건 2. 2017 학년도 교비회계 결산 심의의 건 3. 2018 학년도 교비회계 1 차 추가경정예산 ( 안 ) 심의의 건 1. 2019 학년도 학생정원 조정계획 시행 학과구조변경 ( 안 ) 2. 2018 학년도 대학 보수지침 심의의 건 5 2018 년 6 차 2018.8.31. 2018.8.21. 1. 교원 징계결과 보고의 건 1. 법인 관용차량 구입의 건 6 2018 년 7 차 2018.10.24. 2018.10.12. 1. 임원 선임의 건 2. 정관 개정의 건 3. 추가경정예산 ( 안 ) 심의의 건 1. 불용재산 제각 심의의 건 2. 직제 변경 ( 안 ) 의 건 7 2018 년 8 차 2018.11.16. 2018.11.8. 1. 학과 폐과교원 전환배치 대상자 심의의 건 1. 명예퇴직 및 희망퇴직 시행 ( 안 ) 심의의 건 8 2018 년 9 차 2018.11.30. 2018.11.22. 1. 부총장 선임의 건 2. 정관시행세칙 개정의 건 1. 정관 개정의 건 2. 명예퇴직 및 희망퇴직 세부기준 심의의 건 9 2018 년 10 차 2018.12.27. 2018.12.19. 1. 2019 학년도 법인일반회계 예산 ( 안 ) 심의의 건 2. 2019 학년도 법인수익사업회계 예산 ( 안 ) 심의의 건 3. 2018 학년도 교비회계 제 2 차 추가경정예산 ( 안 ) 심의의 건 4. 교원 재임용 ( 안 ) 심의의 건 5. 총장 선임의 건 6. 2018 학년도 명예퇴직 및 희망퇴직 대상자 심의의 건 1. 2018 학년도 법인일반회계 제 2 차 추가경정예산 ( 안 ) 심의의 건 2. 2018 학년도 법인수익사업회계 제 2 차 추가경정예산 ( 안 ) 심의의 건 3. 퇴직 위로금 지급의 건 10 2019 년 1 차 2019.2.8. 2019.1.30. 1. 2019 학년도 교비회계 예산 ( 안 ) 심의의 건 2. 교원 신규임용 ( 안 ) 심의의 건 3. 정관 개정의 건 1. 유치원 및 건강증진시설 설치의 건 연번 이사회 통지 안건 미통지 안건 심의 · 의결 현황 비고 회차 개최일 통지일 ( 시점 ) 11 2019 년 9 차 2019.12.19. 2019.12.10. 1. 2019 학년도 법인일반회계 제 2 차 추가경정예산 ( 안 ) 심의의 건 2. 2020 학년도 법인일반회계 예산 ( 안 ) 심의의 건 3. 2020 학년도 법인수익사업회계 예산 ( 안 ) 심의의 건 4. 교원 재임용 ( 안 ) 심의의 건 1. 교 육 용 기 본 재 산 취 득 ( 안 ) 심 의 의 건 12 2020 년 1 차 2020.2.5. 2020.1.23. 1. 2019 학년도 교비회계 제 3 차 추가경정예산 ( 안 ) 심의의 건 2. 2020 학년도 교비회계 예산 ( 안 ) 심의의 건 1. 교원 재임용 ( 안 ) 심의의 건 2. 2020 학년도 대학보수 등의 업무 지침 심의의 건 합계 22 건 【 붙임 3】 이사회 소집 통지 방법 부적정 현황 * AY 이사는 해외거주자로서, 본의 동의하에 이메일로 이사회 소집 통지 연번 이사회 재적 이사 불참 이사 이사회 소집 통지 방법 비고 회차 개최일 통지일 ( 시점 ) 등기우편 일반우편 등 1 2017-6 2017.9.8. 2017.9.1. 9 2 - - 2 2017-7 2017.10.31. 2017.10.19. 9 0 - - 3 2017-8 2017.12.15. 2017.12.5. 9 2 - - 4 2018-1 2018.2.8. 2018.1.31. 9 1 - - 5 2018-2 2018.2.27. 2018.2.20. 9 2 - - 6 2018-3 2018.4.20. 2018.4.10. 9 2 - - 7 2018-4 2018.6.26. 2018.6.15. 9 0 - - 8 2018-5 2018.7.14. 2018.7.6. 9 1 - - 9 2018-6 2018.8.31. 2018.8.21. 9 1 - - 10 2018-7 2018.10.24. 2018.10.12. 9 1 - - 11 2018-8 2018.11.16. 2018.11.8. 8 1 - - 12 2018-9 2018.11.30. 2018.11.22. 8 0 - - 13 2018-10 2018.12.27. 2018.12.18. 8 0 - - 14 2019-1 2019.2.8. 2019.1.30. 7 0 - - 15 2019-2 2019.2.26. 2019.2.19. 7 1 - - 16 2019-3 2019.3.26. 2019.3.18. 7 7 - - 17 2019-4 2019.4.25. 2019.4.17. 7 1 - - 18 2019-5 2019.5.30. 2019.5.22. 8 1 - - 19 2019-6 2019.6.27. 2019.6.19. 8 2 - - 20 2019-7 2019.8.26. 2019.8.16. 8 2 - - 21 2019-8 2019.10.24. 2019.10.15. 8 0 - - 22 2019-9 2019.12.19. 2019.12.10. 8 3 - - 23 2020-1 2020.2.5. 2020.1.23. 8 1 - - 24 2020-2 2020.2.27. 2020.2.19. 8 3 - - 25 2020-3 2020.3.26. 2020.3.18. 8 2 - - 26 2020-4 2020.4.28. 2020.4.20. 8 3 - - 27 2020-6 2020.6.26. 2020.6.16. 8 2 - - 감사결과 처분서 기관명 : 학교법인 인산교육재단"
6,"교육용기본재산 관리 부적정 ◦ ｢ 사립학교법 ｣ 제 5 조 제 1 항 및 제 28 조 제 1 항에 따르면 학교법인은 그 설치 · 경영하는 사립학교에 필요한 시설 · 설비와 당해 학교의 경영에 필요한 재산을 갖추어야 하고 , 학교법인이 그 기본재산을 매도 · 증여 · 교환 또는 용도변경하거나 담보에 제공하고자 할 때에는 관할청의 허가를 받아야 하며 , ｢ 사학기관 재무 · 회계 규칙 ｣ 제 43 조에 따르면 법인의 모든 재산의 관리책임자는 이사장이 되고 , 학교에 속하는 교육용 기본재산과 학교용 보통 재산의 운용 책임자는 학교장이 된다고 되어 있는데도 , - 학교법인 인산교육재단은 2017. 5. 1. 정관 시행세칙을 개정하고 대학 부설기관인 □□ 교육원 * 을 법인 산하기관 으로 변경하였음에도",- 학교법인 인산교육재단은 2017. 5. 1. 정관 시행세칙을 개정하고 대학 부설기관인 □□ 교육원 * 을 법인 산하기관 으로 변경하였음에도 【 붙임 】“□□ 교육원 대학시설 사용 현황 ” 과 같이 2017. 5. 부터 2020. 8. 감사일 현재까지 교육용 기본재산인 △ 관 지하 1 층 ( 면적 :387.1m 2 ) 을 관할청 허가없이 법인 산하 □□ 교육원으로 사용하고 있는,"* ｢ 영유아보육법 시행규칙｣ 제13조 제4항에 따라 경상북도지사가 지정 (’96) 한 교육훈련시설 (보육교사 보수교육 등) 로써 보건복지부 지침 (보육사업 안내) 에 따라 독립채산제로 운영 【 학교법인 인산 교육재단 】; 경고 (1 명 ); 통보 - □ □ 교 육 원 이 사 용 하 고 있 는 △ 관 지하 1 층 ( 면적 : 387.1m 2 ) 을 교 육 용 으 로 사용하기 바람 【 붙임 】 □□ 교육원 대학시설 사용 현황 연번 위치 호수 면적 용도 비고 1 △ 관 지하 1 층 B101-1 20.7 교육원 행정실 화장실 , 복도 등 공용공간 면적 제외 2 △ 관 지하 1 층 B101-2 19.3 원장실 3 △ 관 지하 1 층 B101-3 104.9 강의실 ( 꿈 ) 4 △ 관 지하 1 층 B101-4 60.0 강의실 ( 기쁨 ) 5 △ 관 지하 1 층 B101-5 78.7 강의실 ( 행복 ) 6 △ 관 지하 1 층 B102 103.5 몬테소리실 합 계 387.1 (단위 : m 2 ) 감사결과 처분서 기관명 : 선린대학교"
7,"연구교원 연수결과보고서 미제출 등 ◦ ｢ 선린대학교 교수 국내외 연구년제에 관한 규정 ｣ 제 2 조 제 2 호에 따르면 교육개발부문 국내외 연구년제는 학생 교육 , 강의 · 교수학습법 , 교육과정 , 학부 · 학과 ( 계열 ) 발전 등에 관한 개발을 그 목적으로 하고 있고 , ｢ 같은 규정 ｣ 제 8 조의 2 제 3 항 및 제 9 조에 따르면 교육개발부문의 연구교원은 연구기간 만료 후 15 일 이내에 교육개발 결과보고서를 제출하여야 한다고 되어 있으며 , 연수 기간 중 1 회의 중간보고를 하여야 하고 , 연수 만료 후 2 개월 이내에 국내외 연구년 연수결과보고서를 제출 하도록 되어 있으며 , 이 중 어느 하나라도 이행하지 않을 시는 연수기간 동안 수령한 일체의 급여를 봉급 또는 퇴직금에서 공제한다고 되어 있는데도 , - 선린대학교 ▷ 과 교수 G 는 2017. 3. 교육개발부문 연구 교원으로 선발 ( 연구기간 : 2017. 3. 1. ~ 2018. 2. 28., 연구과제 : ▷ 부 교육개발부문 , 제출기한 : 2018. 3. 15.) 되어 연구를 진행 하면서 연구기간 중 중간보고를 하지 않았을 뿐만 아니라 , 연구기간 종료 이후 2020. 8. 감사일 현재까지 교육개발 결과보고서 및 연수결과보고서를 제출하지 아니하는 등","- 선린대학교 ▷ 과 교수 G 는 2017. 3. 교육개발부문 연구 교원으로 선발 ( 연구기간 : 2017. 3. 1. ~ 2018. 2. 28., 연구과제 : ▷ 부 교육개발부문 , 제출기한 : 2018. 3. 15.) 되어 연구를 진행 하면서 연구기간 중 중간보고를 하지 않았을 뿐만 아니라 , 연구기간 종료 이후 2020. 8. 감사일 현재까지 교육개발 결과보고서 및 연수결과보고서를 제출하지 아니하는 등 【 붙임 】 “ 연구교원 연수결과보고서 등 미제출 현황 ” 과 같이 2017. 3. 부터 2020. 2. 까지 위 G 등 교육개발부문 연구년 선발교원 4 명은 연...",【 붙임 】 연구교원 연수결과보고서 등 미제출 현황 연 번 연 도 소속 직급 성명 연구과제명 시작일 종료일 중간 보고 여부 ( 연 수 기 간 중 ) 교육개발 결과보고 여부 ( 연구기간 만료후 15 일 ) 연수결과 보고 여부 ( 연수 만료후 2 개월 ) 비고 1 2017 - 교수 - - 2017.3.1. 2018.2.28. × × × 정년퇴직 (2018.2.28.) 2 2018 - 교수 - - 2018.9.1. 2019.2.28. × × × “ (2019.2.28.) 3 2018 - 교수 - - 2019.3.1. 2019.8.31. × × × “ (2019.8.31.) 4 2019 - 교수 - - 2019.9.1. 2020.2.29. × × × “ (2020.2.29.) 감사결과 처분서 기관명 : 선린대학교
8,"미허가 공무외 국외여행 부적정 ◦ ｢ 사립학교법 ｣ 제 55 조 제 1 항에 따르면 사립학교 교원의 복무는 국 ․ 공립학교 교원에 관한 규정을 준용한다고 되어 있고 , ｢ 국가공무원법 ｣ 제 58 조에 따르면 공무원은 소속 상관의 허가 또는 정당한 사유가 없으면 직장을 이탈하지 못하도록 되어 있으며 , ｢ 선린대학교 교직원 복무규정 ｣ 제 8 조에 따르면 교직원은 소속 상사의 허가 또는 정당한 이유 없이 직장을 이탈하지 못한다고 되어 있고 , ｢ 선린대학교 위임전결규정 ｣ 제 4 조에 따른 별표에는 전 교직원은 국외 출장 및 휴가시 총장의 결재를 받아야 한다고 되어 있는데도 , - 선린대학교 ▽ 계열 부교수 H 은 2017. 4. 20.( 목 ) 부터 2017. 4. 22.( 토 ) 까지 3 일간 총장의 허가 없이 공무 외 국외여행을 실시하는 등",- 선린대학교 ▽ 계열 부교수 H 은 2017. 4. 20.( 목 ) 부터 2017. 4. 22.( 토 ) 까지 3 일간 총장의 허가 없이 공무 외 국외여행을 실시하는 등 【 붙임 】 “ 미허가 공무외 국외 여행 현황 ” 과 같이 2017. 4. 부터 2019. 7. 까지 위 H 등 교원 4 명이 총 7 회 (20 일 ) 에 걸쳐 총장의 허가 없이 해외여 행을 실시한,주의 (4 명 ) 【 붙임 】 미허가 공무외 국외여행 현황 연 번 소속 직급 성명 여행기간 일수 ( 이탈일 ) 미승인 횟수 ( 일수 ) 출발 도착 1 - 부교수 - 2017. 4. 20.( 목 ) 2017. 4. 22.( 토 ) 3 (2) 3 (6) 2018. 4. 26.( 목 ) 2018. 4. 30.( 일 ) 4 (2) 2019. 5. 22.( 목 ) 2019. 5. 23.( 금 ) 2 (2) 2 - 교수 - 2018. 11. 13.( 화 ) 2018. 11. 15.( 목 ) 3 (3) 2 (7) 2019. 7. 16.( 화 ) 2019. 7. 20.( 토 ) 5 (4) 3 - 조교수 - 2019. 4. 16.( 화 ) 2019. 4. 20.( 토 ) 5 (4) 1 (4) 4 - 조교수 - 2019. 6. 30.( 일 ) 2019. 7. 3.( 수 ) 4 (3) 1 (3) 합계 4 명 7 (20) 감사결과 처분서 기관명 : 선린대학교
9,"겸직 미허가 및 복무 미처리 외부 출강 ◦ ｢ 사립학교법 ｣ 제 55 조 제 1 항에 따라 준용하도록 되어 있는 ｢ 국가공무원법 ｣ 제 64 조 및 ｢ 국가공무원 복무규정 ｣ 제 26 조에 따르면 공무원은 공무 외에 영리를 목적으로 하는 업무에 종사하지 못하며 소속 기관장의 허가 없이 다른 직무를 겸할 수 없다고 되어 있으며 , ｢ 학교법인 인산교육재단 정관 ｣ 제 43 조의 12 제 2 항에 따르면 교원이 다른 학교에 출강하고자 할 때 또는 다른 기관에 전속 되지 아니하고 그 기관의 직을 위촉받고자 할 때에는 사전에 총장의 승인을 받아 이사장에게 보고한다고 되어 있고 , ｢ 선린대학교 강사료지급규정 ｣ 제 9 조에 따르면 교원은 타 대학의 출강을 불허하되 타 대학에 출강하고자 할 때에는 사전에 총장의 승인을 받아야 한다고 되어 있으며 , ｢ 국가공무원 복무 ․ 징계 관련 예규 ｣ 제 10 장 3 항 자목 ( 외부강의 출강시 복무관리 철저 ) 에 따르면 담당 직무의 수행과 관련이 있거나 해당기관의 기능수행 및 국가정책수행 목적상 필요한 경우와 해당기관의 장이 필요하다고 인정하는 외부강의에 대하여는 출장 처리 ( 강의요청기관에서 교통편을 제공하거나 여비와 관련한 실비를 지급하는 경우에는 출장여비 미지급 ) 하고 그 외의 경우에는 연가 · 외출 · 조퇴 등으로 근무상황을 처리하도록 되어 있는데도 , - 선린대학교 ▷ 과 조교수 I 는 2017 학년도 1 학기에 총장의 허가를 받지 않았을 뿐만 아니라 근무상황도 처리하지 않은 채 △△ 대학교 강사로 출강하여 “ ㄴㅅ ( 금 , ◦ 경고 (2 명 ) ◦ 주의 (4 명 ) 연 번 지 적 사 항 처 분 09:00~10:50) ” 과목을 강의하는 등","- 선린대학교 ▷ 과 조교수 I 는 2017 학년도 1 학기에 총장의 허가를 받지 않았을 뿐만 아니라 근무상황도 처리하지 않은 채 △△ 대학교 강사로 출강하여 “ ㄴㅅ ( 금 , ◦ 경고 (2 명 ) ◦ 주의 (4 명 ) 연 번 지 적 사 항 처 분 09:00~10:50) ” 과목을 강의하는 등 【 붙임 】“ 겸직 미허가 및 복무 미처리 외부 출강 현황 ” 과 같이 2017 학년도 1 학기 부터 2019 학년도 2 학기까지 위 I 등 교원 6 명은 타 대학에 출강하면서 겸직허가를 받지 않았으며 , I 등 3 명은 근무상황 처리도 하지 않은",【 붙임 】 겸직 미허가 및 복무 미처리 외부 출강 현황 연 번 학과 직급 성명 출강대학 년도 학기 직급 강의과목 학 점 출강요일 ( 강의시간 ) 복무 처리 여부 1 - 조교수 - △△ 대학교 2017 1 학 기 강사 - 2 금 (09:00~10:50) × △△ 대학교 2017 2 학 기 강사 - 1 수 (16:00~16:50) × ▷▷ 대학교 2017 1 학 기 강사 - 2 월 (09:00~11:00) × ▷▷ 대학교 2017 1 학 기 강사 - 2 월 (11:00~13:00) × ▷▷ 대학교 2017 2 학 기 강사 - 1 금 (09:00~10:00) × ▷▷ 대학교 2017 2 학 기 강사 - 1 금 (10:00~11:00) × ▷▷ 대학교 2018 1 학 기 강사 - 2 목 (09:00~11:00) × ▷▷ 대학교 2018 1 학 기 강사 - 2 목 (11:00~13:00) × ▷▷ 대학교 2018 2 학 기 강사 - 1 목 (09:00~10:00) × ▷▷ 대학교 2018 2 학 기 강사 - 1 금 (10:00~11:00) × ▷▷ 대학교 2019 1 학 기 강사 - 2 목 (09:00~11:00) × ▷▷ 대학교 2019 1 학 기 강사 - 2 목 (11:00~13:00) × 2 - 조교수 - ▽▽ 대학교 2017 1 학 기 외래 교수 - 1 화 (09:00~09:50) (10:00~10:50) (14:00~14:50) × ▽▽ 대학교 2017 1 학 기 외래 교수 - 1 화 (09:00~09:50) (10:00~10:50) (14:00~14:50) × ▽▽ 대학교 2017 2 학 기 외래 교수 - 2 금 (09:00~10:50) (11:00~12:50) × ▽▽ 대학교 2017 2 학 기 외래 교수 - 2 금 (09:00~10:50) (11:00~12:50) × 3 - 조교수 - △△ 대학교 2017 1 학 기 강사 - 1 화 (14:00~15:50) × △△ 대학교 2017 2 학 기 강사 - 2 금 (14:00~17:50) × △△ 대학교 2018 1 학 기 강사 - 1 화 (14:00~15:50) × △△ 대학교 2018 2 학 기 강사 - 1 금 (12:00~13:50) × 4 - 조교수 - △△ 대학교 2019 1 학 기 강사 - 2 수 (09:00~10:50) × 5 - 조교수 - △△ 대학교 2019 1 학 기 강사 - 2 토 (12:00~14:45) (18:00~20:40) 근무 시간외 6 - 조교수 - ▽▽ 대학교 2019 1 학 기 강사 - 3 화 (19:45~22:05) 근무 시간외 감사결과 처분서 기관명 : 선린대학교
10,"의원면직 제한대상 해당여부 미확인 ◦ ｢ 사립학교법 ｣ 제 61 조의 2 제 1 항 및 제 4 항에 따르면 교원의 임용권자는 의원면직을 신청한 교원이 비위와 관련하여 형사사건으로 기소 중인 때 , 교원징계위원회에 중징계의 의결을 요구 중인 때 , 감사원 · 검찰 · 경찰 및 그 밖의 수사기관에서 비위와 관련하여 조사 또는 수사 중인 때 , 관할청의 감사부서 등에서 비위와 관련하여 감사 또는 조사 중인 때에는 의원면직을 허용해서는 아니되고 , 교원이 의원면직을 신청한 경우 해당 교원이 의원면직 제한대상에 해당하는지 여부를 감사원과 검찰 ‧ 경찰 , 그 밖의 수사기관에 확인하도록 되어 있는데도 , - 선린대학교는 2017. 6. 9. ◁ 과 조교수 J 가 의원면직을 신청하였으나 감사원과 검찰 · 경찰 , 그 밖의 수사기관에 의원면직 제한대상 해당 여부를 확인하지 않은 채 학교 법인 인산교육재단에 의원면직을 제청하는 등","- 선린대학교는 2017. 6. 9. ◁ 과 조교수 J 가 의원면직을 신청하였으나 감사원과 검찰 · 경찰 , 그 밖의 수사기관에 의원면직 제한대상 해당 여부를 확인하지 않은 채 학교 법인 인산교육재단에 의원면직을 제청하는 등 【 붙임 】 “ 의원 면직 제한대상 해당 여부 미확인 현황 ” 과 같이 2017. 6. 부터 2020. 3. 까지 위 J 등 교원 11 명이 의원면직을 신청 하였으나 감사원과 검찰 · 경찰 , 그 밖의 수사기관에 의원 면직 제한대상 해당 여부를 확인하지 않은 채 학교법인 인산교육재단에 의원면직을 제청한",※ 종합감사 진행 중 감사원 등에 의원면직 제한 대상 여부를 조회한 결과 특이사항 없음; 주의 (3 명 ) 【 붙임 】 의원면직 제한대상 해당 여부 미확인 현황 연 번 소속 직급 성명 의원면직 신청일 법인이사 제청일 이사회 승인일 제한대상자 해당여부 결과 통보일 퇴직일 감사원 검찰 경찰 교육부 1 - 조교수 - 2017. 6. 9. 2017. 6. 13. 2017. 6. 19. × × × × 2017. 6. 9. 2 - 조교수 - 2017. 6. 14. 2017. 6. 19. 2017. 8. 24. × × × × 2017. 8. 31. 3 - 조교수 - 2018. 2. 9. 2018. 2. 12. 2018. 3. 5. × × × × 2018. 2. 28. 4 - 조교수 - 2018. 8. 24. 2018. 8. 24. 2018. 9. 1. × × × × 2018. 8. 31. 5 - 조교수 - 2019. 2. 5. 2019. 2. 25. 2019. 3. 11. × × × × 2019. 2. 28. 6 - 조교수 - 2019. 8. 15. 2019. 8. 21. 2019. 9. 10. × × × × 2019. 8. 31. 7 - 조교수 - 2020. 1. 6. 2020. 1. 7. 2020. 3. 1. × × × × 2020. 2. 29. 8 - 조교수 - 2020. 1. 30. 2020. 1. 31. 2020. 3. 1. × × × × 2020. 2. 29. 9 - 조교수 - 2020. 3. 1. 2020. 3. 5. 2020. 4. 21. × × × × 2020. 3. 1. 10 - 조교수 - 2020. 3. 4. 2020. 3. 5. 2020. 4. 21. × × × × 2020. 3. 10. 11 - 조교수 - 2020. 3. 23. 2020. 3. 24. 2020. 4. 21. × × × × 2020. 3. 29. 감사결과 처분서 기관명 : 선린대학교
11,"부정청탁 및 교원 신규채용 절차 부당 ◦ ｢ 부정청탁 및 금품 등 수수의 금지에 관한 법률 ｣ 제 5 조 제 1 항 제 3 호에 따르면 채용 ․ 승진 ․ 전보 등 공직자등의 인사에 관해 법령을 위반하여 개입하거나 영향을 미치도록 하는 행위를 해서는 아니된다고 되어 있고 , ｢ 선린대학교 교직원윤리규정 ｣ 제 3 조 제 1 항 및 제 2 항에 따르면 교직원은 법인 정관 및 대학 학칙 등의 신분별로 적용받고 있는 제반규정을 준수하고 의무를 이행하여야 하고 , 신의에 따라 성실하게 행동하며 정직하고 공정한 자세를 갖추어야 한다고 되어 있으며 , ｢ 같은 규정 ｣ 제 7 조에 따르면 교직원은 직위를 남용하여 부당한 발언 , 행동을 해서는 아니된다고 되어 있고 , ｢ 학교법인 인산교육재단 정관 ｣ 제 43 조의 11 에 따르면 교원은 소속 학과 전공과 일치하여야 한다고 되어 있으며 , “2020-1 학기 학과별 신규교원 초빙 수요 조사 시행계획 ( 기획팀 -1220, 2019. 9.21.) “ 에 따르면 대학의 교원 · 직원의 수급 및 학생정원 조정에 관한 사항을 고려하여 신규교원 초빙에 대한 수요조사를 시행하도록 되어 있는데도 , - 선린대학교 K 는 2019. 7 월초 ( 날짜 미상 ) 지인 ( 교회 집사 ) 으로부터 ♧ 학 전공자 L 을 소개 받은 후 , 2019. 7. 15. 총장실에서 ♤ 계열장 조교수 M 에게 위 L 의 이력서를 보여주며 신규 교원으로 추천한 사실이 있으며 , ※ ♤계열장 조교수 M는 전공분야 불일치 이유로 거절하였으며, 이후 2020. 1. L은 2020. 1차 ♤계열 전임교원에 응모하였으나 서류전형에서 자격기준 미달로 탈락시킴 - 또한 , 선린대학교 ☆ 장 교수 N 은 2020 학년도 1 학기 ◦ 경징계 (2 명 ) ◦ 통보 - K 를","- 선린대학교 K 는 2019. 7 월초 ( 날짜 미상 ) 지인 ( 교회 집사 ) 으로부터 ♧ 학 전공자 L 을 소개 받은 후 , 2019. 7. 15. 총장실에서 ♤ 계열장 조교수 M 에게 위 L 의 이력서를 보여주며 신규 교원으로 추천한 사실이 있으며 , ※ ♤계열장 조교수 M는 전공분야 불일치 이유로 거절하였으며, 이후 2020. 1. L은 2020. 1차 ♤계열 전임교원에 응모하였으나 서류전형에서 자격기준 미달로 탈락시킴 - 또한 , 선린대학교 ☆ 장 교수 N 은 2020 학년도 1 학기 ◦ 경징계 (2 명 ) ◦ 통보 - K 를 「 부 정 청 탁 및 금 품...","※ L과 O은 2020. 2. 26.자로 임용제청되어 2020. 3. 1.자로 강의전담 교원으로 임용되었으며, L은 2020. 9. 1.자로 전임교원(정년보장) 으로 임용됨 감사결과 처분서 기관명 : 선린대학교"
