연번,지적사항,주요내용(요약),처분요구
22,"휴학자 학적관리 부적정 ◦ ｢ 고등교육법시행령 ｣ 제 4 조에 따르면 학교규칙에는 수업 연한을 기재하도록 되어 있고 , ｢ 선린대학교 학칙 ｣ 제 5 조 , 20 조의 2 및 제 22 조에 따르면 각과의 수업연한은 2 년 으로 하되 , 유아교육과 등은 3 년 , 간호학과는 4 년으로 하며 , 휴학을 하고자 하는 자는 휴학신청 서류를 학과장의 확인을 거쳐 총장의 허가를 얻어 휴학을 할 수 있으며 , 휴학기간 종료 후 수업일수 3 주 이내에 이유 없이 복학 하지 아니한 자 등은 총장이 제적한다라고 되어 있는데도 , - 선린대학교는 1998 년에 ⊙ 과에 입학하여 1 차 휴학한 후 휴학 연장을 신청하지 않은 AI 에 대해 2020 학년도 1 학기 현재까지 ( 휴학연장 횟수 21 회 ) 본인 의사를 확인할 수 있는 제반 서류 구비 , 제적처분 검토 및 총장 결재 등을 거치지 않고 휴학생으로 유지하는 등","- 선린대학교는 1998 년에 ⊙ 과에 입학하여 1 차 휴학한 후 휴학 연장을 신청하지 않은 AI 에 대해 2020 학년도 1 학기 현재까지 ( 휴학연장 횟수 21 회 ) 본인 의사를 확인할 수 있는 제반 서류 구비 , 제적처분 검토 및 총장 결재 등을 거치지 않고 휴학생으로 유지하는 등 【 붙임 】 “ 학생 제적 미처리 현황 ” 과 같이 제적 처분사유가 발생한 191 명의 학생에 대하여 제적 처분 검토 등을 하지 않고 2020. 8. 감사일 현재까지 휴학생으로 유지하고 있는","기관경고; 통보 - 학적관리를 학칙에 따라 처 리 하기 바람 【 붙임 】 학생 제적 미처리 현황 연번 학번 학과 학년 성명 학적 휴학 연장횟수 관련증빙 첨부여부 (Y, N) 1 - 일반휴학 21 N 2 - 일반휴학 16 N 3 - 일반휴학 12 N 4 - 일반휴학 13 N 5 - 일반휴학 13 N 6 - 일반휴학 13 N 7 - 일반휴학 10 N 8 - 일반휴학 10 N 9 - 일반휴학 10 N 10 - 일반휴학 10 N 11 - 일반휴학 10 N 12 - 일반휴학 10 N 13 - 일반휴학 10 N 14 - 일반휴학 10 N 15 - 일반휴학 10 N 16 - 일반휴학 8 N 17 - 일반휴학 9 N 18 - 일반휴학 8 N 19 - 일반휴학 9 N 20 - 일반휴학 8 N 21 - 일반휴학 9 N - 중략 일반휴학 2 N 181 - 일반휴학 2 N 182 - 일반휴학 2 N 183 - 일반휴학 2 N 184 - 일반휴학 2 N 185 - 일반휴학 2 N 186 - 일반휴학 1 N 187 - 일반휴학 2 N 188 - 일반휴학 2 N 189 - 일반휴학 2 N 190 - 일반휴학 3 N 191 - 일반휴학 3 N 감사결과 처분서 기관명 : 선린대학교"
23,"현장실습 출장비 부당 수령 ◦ ｢ 학교법인 인산교육재단 정관 ｣ 제 85 조에 따르면 일반 직원의 복무에 관하여는 국가공무원에게 적용하는 규정을 준용하고 , ｢ 국가공무원법 ｣ 제 56 조 및 제 63 조에 따르면 모든 공무원은 법령을 준수하며 성실히 직무를 수행하여야 하고 , 직무의 내외를 불문하고 그 품위가 손상되는 행위를 하여서는 아니되며 , ｢ 선린대학교 교직원 복무규정 ｣ 제 3 조 및 제 7 조에 따르면 교직원은 법령 , 정관 등 제 규정을 준수하여 성실히 직무를 수행하여야 하며 , 직무의 내외를 불문하고 품위를 손상하는 행위를 하여서는 아니되며 , ｢ 교직원 윤리규정 ｣ 제 2 조 , 제 3 조 및 제 4 조에 따르면 교직원은 맡은 바 임무와 책임에 충실하고 , 교직원으로서 사회적 의무와 윤리적 기준을 준수하고 성실하게 행동하며 정직하고 공정한 자세를 갖추며 , 공사의 구별을 명확하게 함으로써 교직원으로서 학생에게 귀감이 되는 품위있는 행동을 취한다고 되어 있는데도 , - 선린대학교 Z 는 2017. 4. 5. 평생교육원 사회복지 현장 실습생 (AJ) 이 실습하고 있는 ‘◁◁ 보육원 ’ ( 경북 영덕 ㄴ ) 을 수업실태 확인 목적으로 출장신청을 하였으나 출장 증빙자료를 제출하지 않다가 , 이후 평생교육원 수업 수강을 위해 대학 평생교육원에 등원한 위 실습생 (AJ) 과 ‘ 학교 내의 벽면을 배경 ’ 으로 사진을 촬영 ( 날짜 미상 ) 하여 ‘ 실습기관 방문 결과 ’ 를 허위로 제출하여 출장비 54,000 원을 수령하는 등","- 선린대학교 Z 는 2017. 4. 5. 평생교육원 사회복지 현장 실습생 (AJ) 이 실습하고 있는 ‘◁◁ 보육원 ’ ( 경북 영덕 ㄴ ) 을 수업실태 확인 목적으로 출장신청을 하였으나 출장 증빙자료를 제출하지 않다가 , 이후 평생교육원 수업 수강을 위해 대학 평생교육원에 등원한 위 실습생 (AJ) 과 ‘ 학교 내의 벽면을 배경 ’ 으로 사진을 촬영 ( 날짜 미상 ) 하여 ‘ 실습기관 방문 결과 ’ 를 허위로 제출하여 출장비 54,000 원을 수령하는 등 【 붙임 】‘ 출장비 등 부당 수령 ◦ 경징계 (1 명 ) ◦ 시정 ( 회수 ) - 허위로 출장 증빙 자료를 제...","【 붙임 】 출장비 등 부당 수령 현황 연번 연도 일자 방문기관 출장비 식비 실습생명 1 2017 04 월 05 일 - 54,000 - 2 04 월 10 일 - 5,000 - 3 04 월 13 일 - 5,000 - 4 04 월 17 일 - 5,000 - 5 04 월 17 일 - - 6 04 월 18 일 - 5,000 - 7 04 월 18 일 - - 8 04 월 23 일 - 5,000 - 9 04 월 23 일 - - 10 04 월 24 일 - 5,000 - 11 04 월 24 일 - - 12 04 월 24 일 - - 13 04 월 24 일 - - 14 04 월 24 일 - 5,000 - 15 05 월 16 일 - 5,000 - 16 05 월 18 일 - 5,000 - 17 05 월 21 일 - 5,000 - 18 09 월 11 일 - 5,000 8,000 - 19 09 월 11 일 - - 20 09 월 11 일 - 5,000 - 21 09 월 11 일 - - 22 09 월 13 일 - 5,000 8,000 - 23 09 월 13 일 - 5,000 - 24 09 월 13 일 - - 25 09 월 18 일 - 5,000 8,000 - 26 09 월 18 일 - 5,000 - 27 09 월 18 일 - 5,000 - 28 09 월 18 일 - 5,000 - 29 09 월 26 일 - 5,000 8,000 - 30 09 월 26 일 - 5,000 - 중략 118 2019 10 월 08 일 - 5,000 8,000 - 119 10 월 08 일 - 5,000 - 120 10 월 09 일 - 28,000 - 121 10 월 15 일 - 5,000 - 122 10 월 19 일 - 5,000 8,000 - 123 10 월 19 일 - 5,000 - 124 10 월 22 일 - 5,000 8,000 - 125 10 월 22 일 - 5,000 - 126 10 월 22 일 - 5,000 - 127 10 월 22 일 - 5,000 - 128 10 월 22 일 - - 129 10 월 26 일 - 5,000 8,000 - 130 10 월 26 일 - - 131 10 월 26 일 - - 132 11 월 01 일 - 5,000 8,000 - 133 11 월 01 일 - 5,000 - 134 11 월 01 일 - 5,000 - 135 11 월 15 일 - - 136 11 월 15 일 - 5,000 - 합 계 580,000 248,000 감사결과 처분서 기관명 : 선린대학교"
24,"성적 부여 부적정 ( ◦ ｢ 선린대학교 학칙 ｣ 제 28 조 제 3 항 및 ｢ 선린대학교 학칙 시행규칙 ｣ 제 40 조에 따르면 공무 · 상고 · 질병 · 기타 부득 이한 사정으로 시험에 응하지 못할 때는 추가시험에 응시할 수 있으며 , 추가시험의 성적은 ‘B+’ 까지 인정 할 수 있고 , ｢ 같은 규칙 ｣ 제 29 조의 2 및 ｢ 선린대학교 성적평가에 관한 지침 (2018.2.23.) ｣ 제 8 조에 따르면 실격 과목 (‘F’) 이거나 이미 취득한 교과목 중 성적이 ‘D’ 또는 ‘D+’ 인 경우에는 재이수 수강신청을 할 수 있으며 , 재이수로 취득한 성적은 ‘A’ 를 초과할 수 없다고 되어 있는데도 ,",- 선린대학교 ▶ 과 부교수 AM 는 2019 학년도 2 학기에 ‘ ㄴㅈ ’ 교과목 성적을 평가하면서 추가시험에 응시한 ▶ 과 1 학년 AK 학생에게 성적 ‘A’ 를 부여하는 등 【 붙임 1】 “ 추가 시험 응시 학생 성적 부여 부적정 현황 ” 과 같이 2019 학년도 2 학기부터 2020 학년도 1 학기까지 위 AM 등 교수 5 명은 추가시험에 응시한 위 AK 등 학생 2 명에게 성적 ‘A’ 를 부여한 사실이 있음 【 재이수 학생 성적 부여 부적정 】- ② - 선린대학교 ◆ 과 부교수 AN 은 2018 학년도 1 학기에 ‘ ㄴㅊ ’ 교과목 성적을 평가하면서 ◆ 과...,【 붙임 1】 추가시험 응시 학생 성적 부여 부적정 현황 연번 해당학기 과목명 담당교원 학생 시험구분 ( 추가시험 사유 ) 추가시험 성적 학과 직급 성명 학과 학년 성명 ( 학번 ) 1 2019 - 부교수 - 기말 ( 질병 ) A 2 2019 - 강사 - A 3 2019 - 강사 - A 4 2019 - 강사 - A 5 2020 - 교수 - 기말 ( 조부사망 ) A 【 붙임 2】 재이수 학생 성적 부여 부적정 현황 연 번 재이수 학기 과목명 담당교원 학생 기이수 성적 재이수 성적 학과 직급 성명 학년 학과 성명 ( 학번 ) 1 2018 - 부교수 - F A+ 2 2018 - 조교수 - F A+ 3 2018 - 강사 - F A+ 4 2018 - 조교수 - F A+ 5 2020 - 강사 - F A+ 6 2020 F A+ 7 2020 - 조교수 - F A+ 8 3 - - F A+ 9 3 - - F A+ 10 3 - - D A+ 11 3 - - F A+ 12 3 - - F A+ 13 3 - - F A+ 14 3 - - F A+ 15 3 - - F A+ 16 3 - - F A+ 17 3 - - D+ A+ 18 3 - - F A+ 감사결과 처분서 기관명 : 선린대학교
25,"근속포상 부상 지급 절차 등 부적정 ◦ ｢ 선린대학교 포상규정 (2013. 5. 27. 제정 ) ｣ 제 2 조 , 제 4 조 , 제 5 조 , 제 6 조에 따르면 , 포상대상으로는 대학 발전에 공적이 현저하거나 각종 경기 등에서 우수한 성적을 발휘한 교직원 , 재학생 또는 외부인으로 하고 , 포상의 구분과 자격에 따라 대학에서 10 년 , 20 년 , 30 년 , 40 년 근속한 교직원에게 근속상을 수여하며 , 포상을 할 때 근속상은 표창장에 의해 포상하고 , 포상의 부상은 내부 규정을 원칙으로 하되 해당 포상심사위원회의 의결에 따르며 포상심사위원회의 구성은 직원에 대한 부분은 직원인사위원회에서 , 직원 외에 대한 부분은 교원인사 위원회에서 하는 것으로 되어 있는데도 , - 선린대학교는 2017. 3. 20. 대학에 30 년을 근속한 ▷ 과 교수 AO 등 5 명에게 근속상으로 표창장을 수여하여 포상하면서 포상의 부상에 관한 내부규정 근거나 해당 포상심사위원회 의결 없이 구매대금 합계 5,997,200 원 상당의 순금 17 돈을 지급하는 등","- 선린대학교는 2017. 3. 20. 대학에 30 년을 근속한 ▷ 과 교수 AO 등 5 명에게 근속상으로 표창장을 수여하여 포상하면서 포상의 부상에 관한 내부규정 근거나 해당 포상심사위원회 의결 없이 구매대금 합계 5,997,200 원 상당의 순금 17 돈을 지급하는 등 【 붙임 】 “ 연도별 교 직원 근속 포상대상자 부상 지급 현황 ” 과 같이 2017. 3. 부터 2020. 3. 까지 대학에 근속연수별로 근속한 교직원 20 명에게 근속상으로 표창장을 수여하여 포상하면서 포상의 부상에 관한 내부규정 근거나 해당 포상심사위원회 의결 없이 구매대금 합계 14,942,...","기관경고; 통보 - 포상의 부상에 관한 내 부 규 정 을 마 련 하 고 포상심사위원회의 의결을 거치는 등 관련 규정을 준수 하여 운영하기 바람 【 붙임 】 연도별 교직원 근속 포상대상자 부상 지급 현황 연도 포상 수여일자 근속연수별 대상자 근속연수별 부상품 구매 내역 총 구매대금 ( 원 ) 내부규정 준수 여부 포상심사위원회 의결 여부 교원 직원 소계 2017 3.20. 30 년 1 명 20 년 3 명 10 년 1 명 - 5 30 년 순금 10 돈 20 년 순금 5 돈 10 년 순금 2 돈 5,997,200 규정 부존재 × 2018 3.21. - 30 년 1 명 1 30 년 순금 10 돈 2,323,200 × 2019 3.18. 30 년 1 명 20 년 2 명 10 년 3 명 10 년 2 명 8 30 년 순금 3 돈 20 년 순금 2 돈 10 년 순금 1 돈 3,003,000 × 2020 3.23. 30 년 1 명 20 년 2 명 10 년 1 명 20 년 1 명 10 년 1 명 6 30 년 순금 3 돈 20 년 순금 2 돈 10 년 순금 1 돈 3,619,000 × 계 20 명 39 돈 14,942,400 ※ 매년 근속연수에 따른 부상품 수량이 변동 감사결과 처분서 기관명 : 학교법인 인산교육재단 , 선린대학교"
26,"등록금회계 기타이월금 비율 과도 ◦ ｢ 사립학교법 ｣ 제 32 조의 4 에 따르면 대학교육기관의 장 및 대학교육기관을 설치ㆍ경영하는 학교법인의 이사장은 해당 회계연도의 교비회계 예산을 편성ㆍ집행함에 있어서 이월금을 최소화하도록 노력하여야 하고 , 교육부장관은 대학교육기관의 이월금이 재정규모에 비하여 과다한 경우에는 이월금을 줄이기 위하여 시정요구 . 등 필요한 조치를 할 수 있으며 , ｢ 사립전문대학 ( 법인 ) 기본재산 및 회계관리 안내 (2017. 4. 17. 교육부 전문대학정책과 ) ｣ 의 붙임 ’ 사립전문대학 ( 법인 ) 회계관리 안내서 ‘ 와 ｢ 학교법인 및 사립전문대 결산서 제출 안내 (2018.4.19, 2019.4.25., 2020.5.6., 교육부 전문대학법인팀 , 사립대학정책과 ) ｣ 및 ｢ 사립대학 ( 법인 ) 예결산 작성 유의사항 ( 한국사학진흥재단 홈페이지 공지사항 ) 」 에 따르면 ‘ 사립대학 이월금 처리기준 ’ 에서 연도별 등록금 회계 기타이월금의 적정규모에 대해 등록금회계 수입 총액 ( 자금계산서 기준 ) 대비 기타이월금의 비율은 ‘17 년 1.4% 이내 , ’18 년 이후 1.0% 이내이고 , 기타이월금이 특별한 사유 없이 과도하게 증가한 대학에 대해서는 시정을 요구 ‘ 한다고 되어 있는데도 , - 학교법인 인산교육재단 및 선린대학교는 2017 회계연도의 등록금회계 수입총액 대비 기타이월금 비율을 적정 기준 대비 16.6% 초과 ( 이월금 비율 18.0%, 초과금액 2,752,006 천원 ) 하는 등","- 학교법인 인산교육재단 및 선린대학교는 2017 회계연도의 등록금회계 수입총액 대비 기타이월금 비율을 적정 기준 대비 16.6% 초과 ( 이월금 비율 18.0%, 초과금액 2,752,006 천원 ) 하는 등 【 붙임 】 “ 등록금회계 ( 자금계산서 기준 ) 기타이월금 내역 ” 과 같이 2017 회계연도부터 2019 회계연도까지 【 학교법인 인산 교육재단 】 ◦ 경고 (3 명 ) 【 선린대학교 】 ◦ 경고 (4 명 ) ◦ 통보 - 회계관리 안내서 및 예결산 작성 유의사항의 이월금 처리기준에 따라 등록금회계 수입 총액 대비 기타 이월금의 적정기준 비율을 준수하기 바람...","【 붙임 】 등록금회계 ( 자금계산서 기준 ) 기타이월금 내역 (단위: 천원) 회계 연도 등록금 회계수입 명시이월 기타이월금 내역 기타이월금 적정기준 * 초과금액 (a-b) 금액 (a) 비율 금액 (b) 비율 2017 16,591,896 160,200 2,984,292 18.0 232,286 1.4% 이내 2,752,006 2018 17,263,768 2,000,000 996,573 5.8 172,637 1.0% 이내 823,936 2019 17,057,696 1,971,400 3,329,756 19.5 170,576 1.0% 이내 3,159,180 * 「사립전문대학(법인) 회계관리 안내서」 및 「사립대학(법인) 예결산 작성 유의사항」 감사결과 처분서 기관명 : 선린대학교"
27,"A 관사 사용료 교비회계 집행 부적정 ◦ ｢ 사립학교법 시행령 ｣ 제 13 조 제 2 항에 따르면 교비회계의 세출은 학교운영에 필요한 인건비 및 물건비 , 학교교육에 직접 필요한 시설 ․ 설비를 위한 경비 및 기타 학교교육에 직접 필요한 경비 등으로 되어 있고 , ｢ 사학기관 재무 ․ 회계 규칙 ｣ 제 21 조에 따르면 법인 및 학교에 속하는 회계의 세출예산은 이를 목적 외에 사용하지 못하도록 하고 있으며 , ｢ 선린대학교 관사관리규정 ｣ 제 4 조 및 제 7 조에 따르면 , 관사의 사용대상자는 총장 , 기타 총장이 특별히 필요하다고 인정하는 자로 , 관사 사용에 있어 사용자에게 부과되는 일체의 공과금 ( 관리비 , 전기 , 상하수도 , 도시가스 , 케이블방송 , 인터넷 사용료 ) 과 제비용 ( 소모품 및 소규모 수선비 포함 ) 및 사용자 과실로 인한 시설수선비는 사용자가 부담하도록 되어 있는데도 , - 선린대학교는 2016. 10. 법인 A 가 사용한 교육용 관사 ( 경북 포항시 북구 흥해읍 ㄷ ) 의 2016 년 9 월분 관리비 등 합계 109,210 원을 교비회계에서 집행하는 등","- 선린대학교는 2016. 10. 법인 A 가 사용한 교육용 관사 ( 경북 포항시 북구 흥해읍 ㄷ ) 의 2016 년 9 월분 관리비 등 합계 109,210 원을 교비회계에서 집행하는 등 【 붙임 】 “ 법인 A 교육용 관사 사용료 현황 ” 과 같이 2016. 9. 부터 2019. 9. 까지 A 개인이 부담해야 할 관사 관리비 등 총 37 건 합계 5,526,310 원을 교비회계에서 집행한","경고 (5 명 ); 시정 ( 회수 ) - 부적정하게 집행한 관사 관리비 등 합계 5,526,310 원을 A 로 부터 회수하여 교비 회 계 에 세 입 조 치 하 기 바람 【 붙임 】 법인 A 교육용 관사 사용료 현황 ( 단위 : 원 ) 순 대상년월 관리비 인터넷 사용료 및 tv 수신료 도시가스료 합계 1 2016 년 9 월분 76,860 29,230. 3,120 109,210 2 2016 년 10 월분 86,810 29,230 13,680 129,720 3 2016 년 11 월분 78,270 29,230 11,810 119,310 4 2016 년 12 월분 83,090 29,230 69,130 181,450 5 2017 년 1 월분 88,260 29,230 55,220 172,710 6 2017 년 2 월분 92,750 25,930 88,220 206,900 7 2017 년 3 월분 90,320 29,230 56,670 176,220 8 2017 년 4 월분 96,960 29,230 49,770 175,960 9 2017 년 5 월분 88,100 29,230 15,500 132,830 10 2017 년 6 월분 90,870 29,230 3,270 123,370 11 2017 년 7 월분 99,770 29,230 4,910 133,910 12 2017 년 8 월분 98,090 29,230 5,720 133,040 13 2017 년 9 월분 92,590 29,230 4,930 126,750 14 2017 년 10 월분 83,690 29,230 22,380 135,300 15 2017 년 11 월분 84,860 29,230 43,590 157,680 16 2017 년 12 월분 83,000 29,230 57,150 169,380 17 2018 년 1 월분 88,820 22,630 52,860 164,310 18 2018 년 2 월분 93,560 22,630 75,680 191,870 19 2018 년 3 월분 88,370 22,630 56,000 167,000 20 2018 년 4 월분 91,000 22,630 34,440 148,070 21 2018 년 5 월분 92,180 22,630 27,700 142,510 22 2018 년 6 월분 78,790 22,630 9,160 110,580 23 2018 년 7 월분 90,390 29,230 1,590 121,210 24 2018 년 8 월분 105,640 29,230 5,480 140,350 25 2018 년 9 월분 81,740 29,230 - 110,970 26 2018 년 10 월분 - - 51,730 51,730 27 2018 년 11 월분 174,460 59,990 51,730 286,180 28 2018 년 12 월분 81,160 29,230 63,960 174,350 29 2019 년 1 월분 86,220 29,230 34,830 150,280 30 2019 년 2 월분 90,300 29,230 68,670 188,200 31 2019 년 3 월분 85,960 29,230 49,380 164,570 32 2019 년 4 월분 90,490 29,230 29,360 149,080 33 2019 년 5 월분 82,910 29,230 12,450 124,590 34 2019 년 6 월분 86,610 29,230 9,380 125,220 35 2019 년 7 월분 92,720 29,230 11,300 133,250 36 2019 년 8 월분 144,230 29,230 7,220 180,680 37 2019 년 9 월분 85,920 29,230 2,420 117,570 계 3,325,760 1,040,140 1,160,410 5,526,310 감사결과 처분서 기관명 : 학교법인 인산교육재단 , 선린대학교"
28,"산학협력단 사업 자금 관리 및 회계처리 부적정 등 ◦ ｢ 사학기관 재무 · 회계규칙 ｣ 제 4 조에 따르면 법인과 학교의 재무와 회계는 건전하게 운영하여야 하며 국가의 정책과 사회의 공공기관으로서의 의무와 그 설립목적에 반하 여서는 아니된다고 되어 있으며 ｢ 산학협력단 회계처리 규칙 ｣ 제 15 조 제 1 호 , 제 2 호에 따르면 , 산학협력단의 소관에 속하는 모든 수입 및 지출은 이를 산학협력단의 회계에 계상하여야 하며 회계처리 및 보고는 신뢰할 수 있도록 객관적인 자료와 증거에 의하여 공정하게 처리하여야 한다고 되어 있고 , ｢ 같은 규칙 ｣ 제 31 조에 따르면 산학 협력단의 단장은 회수가 불확실하여 대손이 예상되는 부실채권이 있는 경우에는 합리적이고 객관적인 기준에 따라 대손충당금을 설정하여야 하는데도 ,","- 선린대학교 산학협력단은 고용노동부 대구지방고용노동청 포항지청 ‘2014 년 ☞☞ 기업체험 ’ 사업 ( 사업비 242,825 천원 ) 과 포항시 지방재정지원사업 ‘2014 년 ☜☜ 프로젝트 ’ 사업 ( 사업비 220,000 천원 ) 을 진행하던 중 2014. 8. 5. 부터 2014. 10. 30. 까지 산학협력단 AP 의 사업자금 및 운영비 횡령사건으로 인하여 168,489,651 원 (2015. 4. 결산 기준 ) 의 손실이 발생하였고 , ※ 위 횡령사건으로 AP에 대해 고발조치(`14.12.26.) 및 파면조치 (`15.2.11.) - 2014. 12. 부터...",감사결과 처분서 기관명 : 선린대학교
29,"학교시설사용료 산학협력단 세입처리 부당 ◦ ｢ 사학기관 재무 · 회계규칙 」 제 4 조에 따르면 법인과 학교의 재무와 회계는 건전하게 운영하여야 하며 국가의 정책과 사회의 공공기관으로서의 의무와 그 설립목적에 반하 여서는 아니된다고 되어 있으며 , ｢ 사학기관 재무회계 규칙에 대한 특례규칙 」 제 15 조 제 2 호에 따르면 회계 처리는 신뢰할 수 있도록 객관적인 자료와 증거에 의하여 공정하게 처리하여야 한다고 되어 있고 , ｢ 사립학교법 시행령 」 제 13 조에 따르면 학교시설의 사용료 및 이용료는 교비회계의 세입으로 되어 있는데도 , - 선린대학교 산학협력단은 2017. 8. 23. ‘2017 년 전문대학 취업역량강화사업 ’ 을 진행하는 과정에서 ‘3D 프린트 자격증 취득과정 ’ 수강생들이 사용한 학교시설 (2 층 멀 티미디어실 , 세미나실 ) 사용료 1,200 천원을 ( 재 ) ◇◇ 진흥원으 로부터 받아 교비회계가 아닌 산학협력단 회계로 세 입처리하는 등","- 선린대학교 산학협력단은 2017. 8. 23. ‘2017 년 전문대학 취업역량강화사업 ’ 을 진행하는 과정에서 ‘3D 프린트 자격증 취득과정 ’ 수강생들이 사용한 학교시설 (2 층 멀 티미디어실 , 세미나실 ) 사용료 1,200 천원을 ( 재 ) ◇◇ 진흥원으 로부터 받아 교비회계가 아닌 산학협력단 회계로 세 입처리하는 등 【 붙임 】 “ 학교시설 사용료 산학협력단 세입처리 내역 ” 과 같이 2017. 8. 부터 2019. 9. 까지 위 ‘2017 년 전문대학 취업역량강화사업 등 총 3 건의 사 업을 진행하면서 발생한 학교시설사용료 합계 14,130 천원을 교비회...","※ ‘포항시 영어체험학습 프로그램’ 의 강의실사용료의 경우 2018년도까지는 교비회계로 세입처리하였으나 2019년도에는 이를 변경하여 산학협력단 회계로 세입처리; 경징계 (2 명 ); 경고 (7 명 ); 통보 - 산 학 협 력 단 세 입 으 로 처리한 학교시설 사용료 14,130 천 원 을 교비회계로 전출 하기 바람 【 붙임 】 학교시설사용료 산학협력단 세입처리 내역 순 번 년도 세입 처리일 내용 ( 적요 ) 수입금액 사용시설 1 2017 8.23. 2017 년 전문대학 취업역량강화사업 시설사용료 ( 세미나실 외 ) 1,200,000 2 층 멀티미디어실 , 세미나실 2 2018 8.23. 2018 년도 경북여성일자리사관학교 교육과정 시설사용료 수입 2,280,000 2 층 세미나실 외 3 2019 9.11. 2019 년 포항시 초등학생 영어체험학습 시설사용료 수입 ( 대형홀 , 강의실 ) 10,650,000 성시홀 , 강의실 301 호 , 302 호 합 계 14,130,000 ( 단위 : 원 ) 감사결과 처분서 기관명 : 선린대학교"
