연번,지적사항,주요내용(요약),처분요구
12,"일반직원 신규채용 자격제한 부적정 ◦ ｢ 고용정책기본법 ｣ 제 7 조에 따르면 사업주는 근로자를 모집ㆍ채용할 때에 합리적인 이유 없이 성별 , 신앙 , 연령 , 신체조건 , 사회적 신분 , 출신지역 , 학력 , 출신학교 , 혼인ㆍ임신 또는 병력 등을 이유로 차별을 하여서는 아니 되고 , 균등한 취업기회를 보장하여야 하며 , ｢ 학교 법인 인산교육재단 정관 ｣ 제 83 조 제 2 항에 따르면 일반 직원의 신규 임용에 있어서는 학력에 제한을 두지 아니 하나 , 운영직은 임용될 직종에 관한 자격증 , 면허증 기타 임용권자가 필요로 하는 자격이 있는 자를 인사 규칙이 정하는 바에 따라 우선 임용할 수 있다고 되어 있는데도 , - 선린대학교는 2013. 6. 18. ‘ 직원인사규정 ’ 제 9 조의 2 제 1 항에 직원의 신규임용에 있어서는 학력에 제한을 두지 아니하되 , 임용권자가 필요하다고 인정할 때에는 예외로 할 수 있다는 조항을 신설하고 , 2017. 3. 9. ‘ 선린대학교 직원 채용 공고 ( 평생교육원 임시직 ) ’ 시 지원 자격을 ‘ 교육학 학사학위 이상 소지자 ’ 로 제한하는 등","- 선린대학교는 2013. 6. 18. ‘ 직원인사규정 ’ 제 9 조의 2 제 1 항에 직원의 신규임용에 있어서는 학력에 제한을 두지 아니하되 , 임용권자가 필요하다고 인정할 때에는 예외로 할 수 있다는 조항을 신설하고 , 2017. 3. 9. ‘ 선린대학교 직원 채용 공고 ( 평생교육원 임시직 ) ’ 시 지원 자격을 ‘ 교육학 학사학위 이상 소지자 ’ 로 제한하는 등 【 붙임 】“ 직원 채용 시 학력제한 현황 ” 과 같이 직원인사 규정에 학력제한 규정을 두어 2017. 3. 부터 2020. 8. 감사일 현재까지 위 건 등 총 37 회에 걸쳐 신규직원 채용 시 전문대...","경고 (4 명 ); 통보 - 관련법령 및 정관에 따 라 직 원 인사규정을 개정하기 바람 【 붙임 】 직원 채용 시 학력제한 현황 연 번 공고일 채용부서 모집공고매체 채용예정 인원 지원자 수 합격자 수 제한 학력 비고 1 2017.03.09. - 홈페이지 , 워크넷 1 6 1 대학이상 2 2017.07.20. - 홈페이지 , 워크넷 2 11 2 전문대이상 3 2017.11.06. - 홈페이지 , 워크넷 1 7 1 전문대이상 4 2017.12.01. - 홈페이지 , 기독공보 1 12 1 대학원이상 5 2018.04.02. - 홈페이지 , 워크넷 1 10 0 전문대이상 6 2018.06.28. - 홈페이지 , 워크넷 1 2 0 전문대이상 7 2018.07.09. - 홈페이지 , 워크넷 1 18 0 전문대이상 8 2018.07.26. - 홈페이지 , 워크넷 1 7 0 전문대이상 9 2018.08.10. - 홈페이지 , 워크넷 1 6 1 전문대이상 10 2019.03.08. - 홈페이지 , 워크넷 2 16 0 박사수료이상 교수학습 지원담당 전문대이상 사업행정 담당 11 2019.03.21. - 홈페이지 , 워크넷 1 1 1 박사수료이상 12 2019.03.21. - 1 13 1 전문대이상 13 2019.03.21. - 1 0 0 대학이상 14 2019.03.21. - 1 4 1 전문대이상 15 2019.04.04. - 홈페이지 , 워크넷 1 0 0 전문대이상 16 2019.04.04. - 1 1 1 전문대이상 17 2019.06.13. - 홈페이지 , 워크넷 1 0 0 전문대이상 18 2019.06.13. - 1 0 0 전문대이상 19 2019.06.20. - 홈페이지 , 워크넷 1 3 1 전문대이상 20 2019.06.20. - 1 2 1 전문대이상 21 2019.07.11. - 홈페이지 , 워크넷 1 4 0 전문대이상 22 2019.07.30. - 홈페이지 , 워크넷 1 1 1 전문대이상 23 2019.08.22. - 홈페이지 , 워크넷 1 3 1 전문대이상 24 2019.09.27. - 홈페이지 , 워크넷 1 5 1 전문대이상 25 2019.10.13. - 홈페이지 , 워크넷 1 1 1 대학이상 26 2019.11.04. - 홈페이지 , 워크넷 1 5 0 석사이상 27 2019.11.18. - 홈페이지 , 워크넷 1 2 1 석사이상 28 2020.02.05. - 홈페이지 , 워크넷 1 2 1 석사이상 29 2020.02.14. - 홈페이지 , 워크넷 3 13 2 석사이상 교육성과 관리 등 대학이상 취 ‧ 창업 지원 30 2020.03.06. - 홈페이지 , 워크넷 1 3 1 석사이상 31 2020.03.26. - 홈페이지 , 워크넷 1 18 1 전문대이상 32 2020.04.21. - 홈페이지 , 워크넷 1 9 1 전문대이상 33 2020.04.24. - 홈페이지 , 워크넷 1 2 0 전문대이상 34 2020.06.09. - 홈페이지 , 워크넷 1 2 0 전문대이상 35 2020.06.26. - 홈페이지 , 워크넷 1 2 0 전문대이상 36 2020.07.13. - 홈페이지 , 워크넷 1 1 0 전문대이상 37 2020.07.28. - 홈페이지 , 워크넷 1 2 0 전문대이상 합계 41 194 23 감사결과 처분서 기관명 : 선린대학교"
13,"일반직원 신규채용 절차 부당 변경 등 ◦ ｢ 채용절차의 공정화에 관한 법률 ｣ 제 4 조 및 제 8 조에 따르면 구인자는 채용을 가장하여 아이디어를 수집하거나 사업장을 홍보하기 위한 목적 등으로 거짓의 채용광고를 내서는 아니 되고 , 구인자는 정당한 사유 없이 채용 광고의 내용을 구직자에게 불리하게 변경하여서는 아니 되며 , 구인자는 구직자에게 채용일정 , 채용심사 지연의 사실 , 채용과정의 변경 등 채용과정을 알려야 하고 , 이 경우 홈페이지 게시 , 휴대전화에 의한 문자전송 , 전자우편 , 팩스 , 전화 등으로 알려야 하며 , ｢ 선린대학교 직원인사규정 ｣ 제 4 조에 따르면 직원의 임용은 소정의 절차를 거쳐 총장의 제청으로 이사장이 이를 정하고 , ｢ 선린대학교 일반직원 제한경쟁채용 시행 계획의 건 (2017~2019 년 )｣ 에 채용 일정은 채용공고 , 필기시험 및 면접 , 결과보고 , 직원인사위원회 개최 ( 보고 ), 총장 인사 승인 및 이사장 인사 제청이라고 되어 있는데도 ,","- 선린대학교 P 은 2017. 1. 12. ‘2017 학년 선린대학교 일반 직원 제한경쟁채용 시행 계획 * 의 건 ‘ 을 결재한 후 필기 및 면접시험 결과를 2017. 2. 8. 보고받았으나 , 직원인사 위원회에서 일반직 제한경쟁채용 대상자 6 명 (Q, R, S, T, U, V) 에 대한 직원임용 사항을 심의한 회의결과를 2017. 2. 13. 보고받은 후 , 2017. 2. 16. 객관성 있는 점수의 신뢰를 확보한다는 이유로 위 채용계획을 임의로 취소한 사실이 있으며 , <① 관련 > ◦ 경징계 (1 명 ) <② 관련 > ◦ 경고 (5 명 ) 연 번 지 적 사...",* [안내방법] 홈페이지 게시 또는 휴대전화 문자전송 등 감사결과 처분서 기관명 : 선린대학교
14,"복무 미처리 강의 ◦ ｢ 선린대학교 직원인사규정 ｣ 제 9 조의 3 에 따르면 임시직 이라 함은 학교법인 인산교육재단 정관 제 6 장 제 4 절에 정한 일반직원이 아닌 자로서 대학과 일정기간 고용 계약을 체결하고 업무에 종사하는 직원을 말하며 , ｢ 2018 년 교목 신규임용자 근로계약 * 승인의 건 ( 총무팀 -556,’18.2.5.) ｣ 에 따르면 근로자 X( 임시직 ) 의 임용기간은 2018.2.1. 부터 2019.1.31. 까지로 담당업무는 교목실 교목업무라고 명시 되어 있는데도 , * [근무시간] 매주 5일(09시∼18시) [보수조건] 본봉 251만원 및 상여금, 수당 지급 - 선린대학교 직원 ( 임시직 ) X 는 교목실 교목업무를 하면서 2018. 3. 2. 시간강사 근로계약을 선린대학교와 별도로 체결한 후 2018. 3. 6. 연차 등의 복무처리 없이 ‘ ㄴㅇ ’ 과목을 강의하는 등",- 선린대학교 직원 ( 임시직 ) X 는 교목실 교목업무를 하면서 2018. 3. 2. 시간강사 근로계약을 선린대학교와 별도로 체결한 후 2018. 3. 6. 연차 등의 복무처리 없이 ‘ ㄴㅇ ’ 과목을 강의하는 등 【 붙임 】“ 직원 시간강사 강의현황 ” 과 같이 2018 학년도 1 학기와 2 학기에 걸쳐 ‘ ㄴㅇ ’ 과목을 강의 하면서 복무처리 없이 주당 2 시간 * 씩 총 30 회 강의한,"* 매주 화요일 1, 2교시; 경고 (2 명 ); 주의 (1 명 ) 【 붙임 】 직원 시간강사 강의현황 ※ 강사료 : 회당 50,000원 (시간당 25,000원) 구분 수업시수 개설과목 수업시간표 강의 횟수 비고 2018-1 학기 2 시간 ㄴㅇ 화요일 1,2 교시 15 회 ( 주 1 회 ) 2018-2 학기 2 시간 ㄴㅇ 화요일 1,2 교시 15 회 ( 주 1 회 ) 합 계 - - 30 회 - 감사결과 처분서 기관명 : 선린대학교"
15,"직원 무면허 운전 ◦ ｢ 학교법인 인산교육재단 정관 ｣ 제 85 조에 따르면 일반 직원의 복무에 관하여는 국가공무원에게 적용하는 규정을 준용하고 , ｢ 국가공무원법 ｣ 제 56 조 및 제 63 조에 따르면 모든 공무원은 법령을 준수하며 성실히 직무를 수행 하여야 하고 , 직무의 내외를 불문하고 그 품위가 손상 되는 행위를 하여서는 아니되며 , ｢ 도로교통법 ｣ 제 43 조에 따르면 누구든지 운전면허를 받지 아니하거나 운전면허의 효력이 정지된 경우에는 자동차 등을 운전하여서는 아니된다고 되어 있는데도 , - 선린대학교 Y 는 2018. 9. 1.( 토 ) 음주운전으로 10 월 경 운전면허가 취소된 이후 약 1 년간 무면허기간 이었는데도 , 2019. 3. 13. 배우자 명의 장기렌터카를 이용해 대구까지 직접 운전하는 등","- 선린대학교 Y 는 2018. 9. 1.( 토 ) 음주운전으로 10 월 경 운전면허가 취소된 이후 약 1 년간 무면허기간 이었는데도 , 2019. 3. 13. 배우자 명의 장기렌터카를 이용해 대구까지 직접 운전하는 등 【 붙임 】“2019 년도 무면허 운전 현황 ” 과 같이 2019. 3. 13. 부터 9. 21. 까지 총 18 회에 걸쳐 무면허 운전을 한","통보 ( 문책 , 중징계 ) (1 명 ) < 별도조치 >; 고발 【 붙임 】 2019 년도 무면허 운전 현황 ※ 배우자명의 장기렌터카를 ‘자차’로 표기 연번 운행일 목적 운행지 운행차량 비고 지역 장소 1 3.13. 출장 대구 - 자차 제주출장 2 3.15. 출장 포항 - 자차 제주출장 3 6.14. 출장 포항 - 업무용차량 4 6.15. 출장 포항 - 업무용차량 5 6.16. 출장 포항 - 업무용차량 6 7.5. 출장 대구 - 자차 7 7.15. 출장 포항 - 업무용차량 8 7.24. 출장 포항 - 업무용차량 9 8.5. 출장 울산 - 업무용차량 10 8.14. 출장 포항 - 업무용차량 11 8.19. 출장 경주 - 업무용차량 12 8.27. 출장 포항 - 업무용차량 13 8.28. 출장 포항 - 업무용차량 14 9.17. 출장 포항 - 업무용차량 15 9.18. 출장 영천 - 업무용차량 16 9.19. 출장 포항 - 업무용차량 17 9.20. 출장 대구 - 업무용차량 18 9.21. 출장 대구 - 업무용차량 감사결과 처분서 기관명 : 선린대학교"
16,"직원 근무평정 개입 부당 ◦ ｢ 선린대학교 직원인사규정 ｣ 제 17 조의 2 및 제 17 조의 5 에 따르면 근무성적평정이라 함은 근무성적 평정서에 의해 평가위원이 판정한 평점을 부여하는 것을 말하고 , 근무 성적의","- 선린대학교 Z 는 선린대학교가 ’2018 학년도 직원근무평정 및 성과급 평가 시행 계획 보고 ( 총무팀 -353, ‘19.1.29.) ’ 에 따라 2019. 2. 15. 부터 2019. 2. 18. 까지 평정자별 평정을 완료하였는데도 , 2019. 2. 25. 보직자회의 시작 전에 K 에게 일부 부서의 직원 근무평정을 다시 하도록 하겠다는 보고를 한 후 K 의 지시 * 에 따라 당일 보직자회의에서 일부 부서의 직원 근무평정 재실시를 지시하고 , AA 으 로부터 평정서류를 다시 제출받은",* 평정점수는 85점에서 95점 사이로 하여 골고루 부여; 경징계 (2 명 ) < 별도조치 >; 고발 감사결과 처분서 기관명 : 선린대학교
17,"전임교원 채용 부당 ◦ ｢ 사립학교법 ｣ 제 55 조 제 1 항에 따라 준용되는 ｢ 국가 공무원법 ｣ 제 59 조에 따르면 공무원은 국민 전체의 봉사자로서 친절하고 공정하게 직무를 수행하여야 하고 , ｢ 고등교육법","- 선린대학교는 2019. 3. 2. 교원인사규정 상 전임교원 ( 교수 , 부교수 , 조교수 , 강의전담교원 , 산학협력중점교원 ) 에 해당하지 아니하는 혁신지원단 ‘ 전담교원 ’ 1 명을 신규채용하면서 , 채용분야는 교원의 임무 ( 학생교육 ‧ 지도 , 학문연구 , 산학연협력 ) 에 해당하지 아니하는 ‘ 대학교양 , 비교과 프로그램 융합 ‧ 연계 설계 , 운영 및 성과관리 ’ 로 , 채용조건은 ‘ 전공무관 , 박사수료 이상 , 대학 교육 경력자 우대 ’ 로 하여 신규 채용하기로 하고 , 3. 6. 초빙 공고하여 3. 21. 본교 희망 퇴직자 (‘19.2.28., 전...","경징계 (1 명 ); 경고 (4 명 ); 통보 - 교원인사규정 상 전임교원에 해당 하지 않고 , 교원의 임무를 담당하지 않는 채용분야에 전임교원을 임용 하는 일이 없도록 하기 바람 감사결과 처분서 기관명 : 선린대학교"
18,"신입생 추가모집 전형 부당 ◦ ｢ 고등교육법 ｣ 제 34 조 및 ｢ 같은 법 시행령 ｣ 제 34 조에 따르면 대학입학전형은 입학전형의 기준 및 방법에 따라 공정한 경쟁에 의하여 공개적으로 시행되어야 한다고 되어 있고 , ｢ 전문대학 입학전형 기본사항 (2018 학년도 및 2019 학년도 , 한국전문대학교육협의회 ) ｣ 에 따르면 교육목적에 비추어 균등한 교육기회를 침해하는 부적절한 기준 ( 연령 · 졸업년도 등 ) 으로 자격을 설정하거나 제한할 수 없다고 되어 있는데도 , - 선린대학교 ( 입학처 ) 는 2019 학년도 신입생 선발과정 중 정시모집 후 ◇ 과의 모집정원이 미달하자 추가모집을 ‘ 원서 접수 선착순 ’ 으로 공고 ( 접수기간 : ‘19.2.14. ~ ’19.2.28.) 한 후 전형을 진행하면서 ◇ 과에 지원한 AC 의 교과성적이 최종 합격자인 AD 나 AE 보다 높은데도 최종 합격자 2 명보다 늦게 접수 (‘19.2.18.) 했다는 이유로 탈락시키는 등",- 선린대학교 ( 입학처 ) 는 2019 학년도 신입생 선발과정 중 정시모집 후 ◇ 과의 모집정원이 미달하자 추가모집을 ‘ 원서 접수 선착순 ’ 으로 공고 ( 접수기간 : ‘19.2.14. ~ ’19.2.28.) 한 후 전형을 진행하면서 ◇ 과에 지원한 AC 의 교과성적이 최종 합격자인 AD 나 AE 보다 높은데도 최종 합격자 2 명보다 늦게 접수 (‘19.2.18.) 했다는 이유로 탈락시키는 등 【 붙임 】 “ 추가모집 전형 및 합격자 현황 “ 과 같이 위 ◇ 과 등 3 개학과에 추가전형 지원한 AC 등 4 명은 최종 합격자 14 명보다 교과성적이 높은데도 최종 합...,"중징계 (1 명 ); 경고 (1 명 ); 통보 ( 문책 , 경징계 ) (2 명 ); 통보 - 선착순 모집 등에 따라 불합격된 자에 대해 구제 방안을 검토하기 바람 【 붙임 】 추가모집 전형 및 합격자 현황 순 번 학년 도 수험번호 학과 성명 성적 합격 접수시간 비고 1 2019 - - - - 합격 2019.2.14. 10:11 2 - - - 합격 2019.2.18. 12:31 3 - - - 불합격 2019.2.18. 22:30 정원마감 후 접수 4 - - - - 합격 2019.2.14. 08:59 5 - - - 합격 2019.2.14. 09:00 6 - - - 합격 2019.2.14. 09:01 7 - - - 합격 2019.2.14. 09:02 8 - - - 합격 2019.2.14. 09:05 9 - - - 합격 2019.2.14. 09:07 본인 합격취소 10 - - - 합격 2019.2.14. 09:09 11 - - - 합격 2019.2.14. 09:09 12 - - - 합격 2019.2.14. 09:14 13 - - - 합격 2019.2.14. 12:17 14 - - - 합격 2019.2.15. 05:06 15 - - - 불합격 2019.2.15. 09:52 정원마감 후 접수 16 2020 - - - - 불합격 2020.2.14. 21:25 서류미제출 17 - - - 합격 2020.2.15. 13:53 18 - - - 불합격 2020.2.19. 23:26 정원마감후 원서 접수 19 - - - - 합격 2020.2.18. 13:00 20 - - - 불합격 2020.2.20. 23:15 정원마감후 원서 접수 감사결과 처분서 기관명 : 선린대학교"
19,"입학전형 부정방지대책 미수립 및 이해관계자 사전 미신고 ◦ ｢ 고등교육법 ｣ 제 34 조 및 ｢ 같은 법 시행령 ｣ 제 34 조에 따르면 대학입학전형은 입학전형의 기준 및 방법에 따라 공정한 경쟁에 의하여 공개적으로 시행되어야 한다고 되어 있고 , ｢ 전문대학 입학전형 기본사항 ｣ ( 2016 학년도 이후 , 한국전문대학교육협의회 ) 에 따르면 입학 전형 공정관리위원회에서는 자체 입학부정방지대책을 수립 · 시행 및 친인척이 지원한 교직원의 경우 사전신고를 받아 관리요원에서 배제해야 하는데도 , - 선린대학교는 2017 학년도 이후 현재까지 입학 전형을 실시하면서 ‘ 입학전형 공정관리대책위원회 ’ 에서 입학 부정방지대책을 수립하지 않았으며 , ․ 이에 따라 AF 등 7 명은","- 선린대학교는 2017 학년도 이후 현재까지 입학 전형을 실시하면서 ‘ 입학전형 공정관리대책위원회 ’ 에서 입학 부정방지대책을 수립하지 않았으며 , ․ 이에 따라 AF 등 7 명은 【 붙임 】“ 교직원 자녀 입시지원 현황 “ 과 같이 2018 학년도부터 2019 학년도까지 본인들의 자녀 ( 총 7 명 ) 가 지원함을 알고 있음에도 사전신고를 하지 않았고 , ․ 특히 2018 학년도 선린대학교 AF 는 본인이 재직하고 있는 ▶ 과 수시 1 차에 아들 ( 자 ) AG 가 지원하여 합격 * 한 전형과정에 사전 신고 및 회피하지 않아 관리 요원에서 배제되지 않고 입학 업무...",* 48명 모집에 86명이 지원하여 전형결과 49위였으나 41명이 최종 등록하여 합격; 중징계 (1 명 ); 경고 (7 명 ) 【 붙임 】 교직원 자녀 입시지원 현황 학생 학 년 도 모집 시기 모집단위 합격 전형 과정 등록 여부 직원인적사항 수험 번호 성명 관 계 여부 순 위 당시 소속 직위 ( 급 ) 성명 - - 자 2018 수시 1 - 합격 49 48 명 모집 최종등록 41 명 등록 - 교수 ( 처장 ) - - - 자 2018 정시 - 합격 4 2 명 모집 최종등록 4 명 등록 - 센터장 - - - 녀 2019 수시 2 - 합격 9 12 명 모집 등록 - 교수 - - - 자 2019 수시 1 - 합격 66 94 명 모집 등록 - 7 급 - - - 자 2020 수시 1 - 합격 12 30 명 모집 등록 - 교수 - - - 자 2020 수시 2 - 합격 4 22 명 모집 등록 - 7 급 - - - 자 2020 수시 1 - 합격 137 미 등록 - 교수 - 감사결과 처분서 기관명 : 선린대학교
20,"입학 전형 계획 변경 부당 ◦ ｢ 고등교육법 ｣ 제 34 조의 5 제 4 항에 따라 대학의 장은 입학전형을 공정하게 시행하고 응시생에게 입학에 대한 정보를 제공하기 위하여 매 입학연도의 전 학년도가 개시되는 날의 10 개월 전까지 대학입학전형시행계획을 수립하여 공표하도록 되어 있고 , ｢ 같은 법 시행령 ｣ 제 33 조 제 3 항 및 ｢ 2019 학년도 전문대학 입학전형 기본 사항 ｣ Ⅰ . 총칙 (2. 전문대학입학전형기본사항 원칙 ) 에 따르면 대학입학전형시행계획을 변경할 수 있는 경우는 천재 지변 등 교육부장관이 인정하는 부득이한 사유가 있는 경우로 되어 있으며 , “ 선린대학교 2019 학년도 입학전형 시행계획 (‘18.4.)” 에 따르면 수시모집 면접 방식은 대면 으로 하고 면접장소는 학교 홈페이지를 통해 안내되는 ’ 학내 지정장소 ‘ 로 되어 있는데도 , - 선린대학교는 ▼ 과에서 면접 방식 변경을 요청하자 천재 지변 등 부득이한 사유가 없음에도 2018. 9. 29. 수시모집 면접방식에 전화면접 추가한 사실을 학교 홈페이지에 공고한 후 수시 1 차 응시생 AH ( 수험번호 ******) 를 대상 으로 정확한 신원확인 없이 전화 면접을 실시하는 등",- 선린대학교는 ▼ 과에서 면접 방식 변경을 요청하자 천재 지변 등 부득이한 사유가 없음에도 2018. 9. 29. 수시모집 면접방식에 전화면접 추가한 사실을 학교 홈페이지에 공고한 후 수시 1 차 응시생 AH ( 수험번호 ******) 를 대상 으로 정확한 신원확인 없이 전화 면접을 실시하는 등 【 붙임 】“2019 학년도 수시 모집 전화면접 실시 현황 ” 과 같이 위 ▼ 과 등 3 개 학과 * 에서 면접 방식 변경을 요청하자 천재지변 등 부득이한 사유가 없음에도 두 차례 ** 에 걸쳐 수시모집 응시생 110 명을 대상으로 정확한 신원확인 없이 전화 면접을 실시한,"* ▼과, ◀계열, ▽계열 ** (수시1차) ’18.10.6. / (수시2차) ’18.11.24.; 중징계 (1 명 ); 통보 ( 문책 , 경징계 ) (2 명 ) 【 붙임 】 2019 학년도 수시 모집 전화면접 실시 현황 연번 학과 구분 수험번호 성명 일자 실시자 합격여부 1 - 수시 1 차 - - 2018.10.06 - 합격 2 수시 1 차 - - 2018.10.06 불합격 3 수시 1 차 - - 2018.10.06 4 수시 1 차 - - 2018.10.06 5 수시 1 차 - - 2018.10.06 6 수시 2 차 - - 2018.11.24 불합격 7 수시 2 차 - - 2018.11.24 8 수시 2 차 - - 2018.11.24 9 수시 2 차 - - 2018.11.24 10 수시 2 차 - - 2018.11.24 11 수시 2 차 - - 2018.11.24 12 - 수 시 1 차 - - 2018.10.06 - 불합격 13 수시 1 차 - - 2018.10.06 14 수시 1 차 - - 2018.10.06 15 수시 1 차 - - 2018.10.06 ( 전화불통 ) 16 수시 1 차 - - 2018.10.06 17 - 수시 1 차 - - 2018.10.06 - 불합격 18 수시 1 차 - - 2018.10.06 19 수시 1 차 - - 2018.10.06 20 수시 1 차 - - 2018.10.06 21 수시 1 차 - - 2018.10.06 22 수시 1 차 - - 2018.10.06 23 수시 1 차 - - 2018.10.06 24 수시 1 차 - - 2018.10.06 25 수시 1 차 - - 2018.10.06 26 수시 1 차 - - 2018.10.06 - 27 수시 1 차 - - 2018.10.06 28 수시 1 차 - - 2018.10.06 29 수시 1 차 - - 2018.10.06 30 수시 1 차 - - 2018.10.06 31 수시 1 차 - - 2018.10.06 32 수시 1 차 - - 2018.10.06 33 수시 1 차 - - 2018.10.06 34 수시 1 차 - - 2018.10.06 - 중략 101 수시 2 차 - - 2018.11.24 - 102 수시 2 차 - - 2018.11.24 - 103 수시 2 차 - - 2018.11.24 104 수시 2 차 - - 2018.11.24 105 수시 2 차 - - 2018.11.24 106 수시 2 차 - - 2018.11.24 107 수시 2 차 - - 2018.11.24 108 수시 2 차 - - 2018.11.24 109 수시 2 차 - - 2018.11.24 110 수시 2 차 - - 2018.11.24 감사결과 처분서 기관명 : 선린대학교"
21,◆과 편입학 전형 부당 ◦ ｢ 고등교육법 ｣ 제 34 조 및 ｢ 같은 법 시행령 ｣ 제 34 조에 따르면 대학입학전형은 입학전형의 기준 및 방법에 따라 공정한 경쟁에 의하여 공개적으로 시행되어야 한다고 되어 있으며,"- 선린대학교는 2019. 12. 10. ‘ 입시전형위원회 ’ 를 개최 하여 ‘2020 학년도 편입학 시행계획 ’ 을 마련 ( 전형방법으로 전적대학 성적 50% 와 면접 50% 으로 확정 ) 하면서 면접고사 세부시행계획을 따로 수립하지 않고 단지 위 위원회의 위원장이 “ 편입학 특성에 맞는 학과별 면접평가서를 제작 · 활용해 학생을 공정하게 평가 · 선발하기로 함 “ 으로 정하였고 , ․ 이에 따라 ◆ 과는 응시자 7 명 * 을 대상으로 면접을 실시 하면서 문제출제방법 , 문제지 인수인계 등 보안관리 및 문제지 배부방법 등 세부시행계획을 마련하지 않고 면접평가를 실시...",* 지원자 총 11명(1명 모집) 중 4명은 자격미달로 탈락; 경징계 (1 명 ); 경고 (2 명 ) 감사결과 처분서 기관명 : 선린대학교
