연번,지적사항,주요내용(요약),처분요구
40,보강 未 실시 등 ◦,"- 세종대학교 나노신소재공학과 W는 2016. 12. 2. 출장으로 결강한 ‘ㄹ’ 교과목에 대한 보강을 실시하지 않는 등 【붙임1】“결강 현황”과 같이 2016학년도 2학기부터 2018 학년도 2학기까지 위 W 등 4명은 출장에 따라 합계 15 시간을 결강하고도 이에 대한 보강을 실시하지 않은 사실이 있으며, ․ 특히, 위 W는 2016학년도 미보강 시수 3시간에 대한 초과 강의수당 79,500원을 지급받는 등【붙임2】“초과강의 수당 수령 부적정 현황”과 같이 위 W 등 4명은 미보강 시수 15시간에 대한 초과강의수당 합계 397,500원을 지급받은 사실이 있음. <...",. 【 붙임1 】 결강 현황 연 번 학과 직급 담당 교수 결강 현황 교과목 학기 일시 시수 사유 1 나노신소재 공학과 - W ㄹ 2016-2 ’16.12.2. 10:30-12:00 1.5 출장 2 2016-2 ’16.12.2. 12:00-13:30 1.5 출장 3 - - - 1 ’18.4.9. 09:00-10:30 1.5 출장 4 1 ’18.3.29. 18:00-19:30 1.5 출장 5 - - - 2 ’18.9.27. 09:00-10:30 1.5 출장 6 2018-2 ’18.10.2. 09:00-10:30 1.5 출장 7 - - - 1 ’17.4.7. 18:00-19:00 1 출장 8 2 ’17.9.20. 13:30-15:00 1.5 출장 9 1 ’18.3.28. 15:00-16:30 1.5 출장 10 1 ’18.3.27. 15:00-16…
41,봉사장학금 부당 지급 ◦,"- 세종대학교 바이오융합공학과 AM (3학년, 학번 : ******) 은 2016학년도 1학기에 旣 수령한 국가장학금과 수령 예정 교내장학금 총액이 등록금과 같게 되어 ‘ㅂ’ 활동에 따른 봉사장학금을 추가로 받을 수 없게 되자, 2016. 5월 (날짜 미상) 봉사장학금 수령 대상이 아닌 같은 학과 AN (3학 년, 학번 : ********) 으로 하여금 봉사장학금 수령 대상자로 AN 본인을 기재하여 학과사무실에 제출하게 하였는 데도, 바이오융합공학과 AO과 AP은(는) 봉사장학금 수령 대상 여부를 제대로 확인하지 않고 ‘2016-1학기 학회장 및 과(반)대표 봉사장학...","※ 식품공학과(AS, AT)와 만화애니메이션학과(AU, AV)는 위 협조문에 따라 자체 조사를 실시하여 대리수령자가 있음을 확인하고 조사 결과를 학생지원과로 제출함 【 붙임 】 봉사장학금 부당 수령 현황 연번 학기 학과 봉사장학금 수령 결격자 명의 대여자 수령자 명단 공문 기안·결재자 비고 자격 요건 학번 당시 학년 이름 비고 학번 당시 학년 이름 대리수령 금액(천원) - - 1 2016 -1 바이오 융합공 학과 - ****** 3 AM 해당학기 전액장학 금 대상 (국가,교내 장 학금) **** **** 3 AN 2,137 AP AO 2 2016 -2 바이오 융합공 학과 - ****** 3 AM 해당학기 전액장학 금 대상 (국가,교내 장 학금) **** **** 3 AN 2,137 AP AO 3 2017 -1 바이오 융합공 학과 - 해당학기…"
42,신축공사 未 분리 발주 ◦,"- 세종대학교는 “◘◘ 신축공사”를 전기공사와 통신공사 로 분리하여 발주해야 하는데도 2015. 12. 17. 제42차 건설위원회 (위원장: AW) 회의를 개최하여 공사비 절감, 계약관리 일원화, 하자구분 불명확으로 인한 분쟁예방 등 사유로 통합하여 발주하기로 심의·의결하고, 2016. 5. 24. ◙◙ (대표 K) 와 “◘◘ 신축공사 (계약금액 58,663,000 천원) ”를 계약하면서 전기공사 (금액 4,222,900천원) 와 통신 공사 (금액 4,313,100천원) 를 포함하여 일괄 계약 (총장 결재) 한",. <별도조치>; 고발; 경고(6명); 주의(1명) 감사결과 처분서 기관명 : 세종대학교
43,신축공사 시공 부적정 ◦,"- 세종대학교는 2016. 5. 24. ◙◙ (대표 K) 와 계약한 “◘◘ 신축공사 (계약금액 58,663,000천원, 공사기간 : ‘16. 5. 24. ∼ ‘18. 8. 31.) ”를 추진하면서 당초 설계된 오픈트렌치 물량 (285m) 이 현장 여건으로 실제 시공물량은 감소 (64m) 되었는데도 공사비 993천원 상당을 감액 조치하지 않는 등【붙임】“신축공사 시공 부적정 현황”과 같이 2016. 5. 24.부터 2019. 5. 31. 감사일 현재까지 9건의 부적정 시공에 대하여 공사비 합계 80,151천원 상당을 감액 조치하지 아니한","경고(2명); 통보 - 부적정 시공 9건에 대한 공사비 합계 80,151천원을 감액 조치하기 바람 【붙임】 신축공사 시공 부적정 현황 (단위: 천원) * 순공사비에서 일반관리비, 이윤 포함 공사명 계약일 계약금액 계약 상대방 공종 구분 시공 내역 당초설계 실제시공 부적정 내용 未감액 공사비 * 공사기간 ◘◘ 신축 ’16. 5. 24. 58,663,000 ◙◙ 대표 K 금속공사 오픈트렌치 (285m) 오픈트렌치 (221m) 감소 시공 물량 미정산 993 집기공사 고정식의자설치 (488개) 고정식의자설치 (476개) 감소 시공 물량 미정산 2,124 조경공사 느티나무 (10주) 느티나무 (6주) 감소 시공 물량 미정산 2,885 연도공사 연도 보온 (1식) 연도 보온 (0식) 미시공 물량 미정산 34,272 ’16. 5. 24. ∼ ’18. 8…"
44,시설공사 제경비 정산 부적정,"- 세종대학교는 2017. 1. 20. ◔◔ (대표 AX) 과 계약한 “ㅅ 강의실 개보수공사 (계약금액 78,674천원) ”를 준공처리하면서 공사금액에 계상된 환경보전비 중 증빙자료가 없는데도 집행된 301천원을 감액 정산하지 않는 등【붙임】“시설 공사 환경보전비 부적정 정산 현황”과 같이 2017. 1.부터 2018. 10.까지 위 공사 등 3건의 공사에서 증빙자료가 없거나 업체가 사용불가 항목 등으로 집행한 환경 보전비 합계 704천원을 감액 정산하지 아니한 사실이 있음. 【안전관리비 조정에 관한 사항】--------------------------② ◦「사학기관...",". 【붙임】 시설공사 환경보전비 부적정 정산 현황 ( 단위 : 천원 ) * 일반관리비, 이윤 포함 ** (연번2) 마스크, 청소용품, (연번3) 청소인건비 연번 공사명 계약일 준공일 계약 금액 환경보전비 정산(감액) 필요내역 계약 상대방 담당자 감액사유 [A] 간접비 * [B] 소계 [A+B] 1 ㅅ 강의실 개보수공사 2017. 1. 20. 2017. 2. 17. 78,674 301 (증빙자료 없음) - 301 ◔◔ 대표 K 2017. 9. 28. 2017. 10. 25. 84,997 203 (사용불가 항목 ** ) 36 239 - 2018. 10. 1. 2018. 10. 31. 59,500 135 (사용불가 항목 ** ) 29 164 - - 합 계(3건) 704"