연번,지적사항,주요내용(요약),처분요구
1,수당 지급 부적정 ◦,"- 학교법인 대양학원은 2014. 1.13. 근무시간 중 개최한 징계위원회 준비 명목으로 A 등 법인직원 2명에게 합계 250천원을 수당으로 지급하는 등【붙임】“근무시간 중 개최한 회의 준비 명목 수당 지급 현황”과 같이 2014. 1. 부터 2018. 2.까지 근무시간 중 개최한 각종 회의 준비 명목으로 위 A 등 법인직원 6명에게 총 13회에 걸쳐 합계 3,450천원을 수당으로 지급한","경고(5명); 시정(회수) - 근무시간 중 개최 한 각종 회의 준비 명목 수당으로 지 급한 합계 3,450 천원을 A 등 관 련자 들 로부터 회 수 하여 법인회계에 세입 조 치 하 기 바람 【 붙임 】 근무시간 중 개최한 회의 준비 명목 수당 지급 현황 (단위:천원) 연 번 구분 회의일자 지급일자 A - - - - - 합계 1 징계위원회 2014.1.13 2014.1.21 200 - - - - 50 250 2 세종대학교 일반직원 징계위원회 2014.7.15 2014.7.30 200 - - 250 3 징계위원회 2016.1.27 2016.2.11 200 - - 250 4 예산소위원 회 2016.2.12 2016.2.19 200 - - 250 5 징계위원회 2016.5.24 2016.6.1 200 - - 250 6 징계위원회 2016.12.6…"
2,무허가 건축 이행강제금 납부 ◦,"- 학교법인 대양학원은 2016. 4. 7. 종로구청으로부터 법인 소유 ○○ 부지에 가설한 무허가 건축물 (컨테이너 1동) 에 대한 ‘자진 시정명령 및 이행강제금 부과’ 예고 통지를 받고도 위 건축물을 자진 철거하지 아니하여 이행강제금 1,521천원을 부과 받고 2016. 4. 18. 법인회계에서 납부한",경고(3명) 감사결과 처분서 기관명 : 학교법인 대양학원
3,수익용 부동산 임대보증금 관리 부적정 ◦,"- 학교법인 대양학원은 2010. 2. 26. 수익용 기본재산인 □□ 부지 {서울시 중구 소재} 임대보증금 150,000천원을 법정부담금 명목으로 세종대학교 교비회계로 전출하는 등 【붙임】“수익용 기본재산 (부동산) 임대보증금 관리 부적정 현황”과 같이 2010. 10.부터 2012. 2.까지 위 □□ 부지 등 2곳의 수익용 기본재산 (부동산) 임대보증금 합계 720,000천원을 법정부담금 명목으로 세종대학교 교비회계로 전출한","※ 전출 이후 합계 5억원을 임대보증금 명목으로 법인 계좌로 별도 예치; 통보 - 임 대 보 증 금 220,000 천원 (720,000천원 - 500,000천원) 상당액 을 확 보 하 여 별 도 로 관 리 하 기 바 람; 기관주의 【 붙임 】 수익용 기본재산(부동산) 임대보증금 관리 부적정 현황 ( 단위 : 천원 ) 연번 건명 부동산 유형 임대보증금 현황 임대보증금 법정부담금 명목 전출액 (전출일자) 별도 예치액 1 □□ 토지 (2,227.2㎡) 150,000 150,000 (2010. 2. 26) 150,000 2 △△ 건물 (55개 업체 중 일부) 570,000 570,000 (2012. 2. 24) 350,000 합계 720,000 720,000 500,000 감사결과 처분서 기관명 : 학교법인 대양학원"
4,재산 부당관리 등 임원 직무 태만 ◦,"- 학교법인 대양학원 및 이 법인 이사회는 2013. 12. 교육부 회계부분감사에서 ‘수익용기본재산 관리 부적정 {수익률 미흡( 최대 1.5% )} ’건으로 ‘경고 및 통보’ 처분을 받고도 【붙임1】“수익용기본재산 低수익 현황”과 같이 2014회계연도부터 2018회계연도까지 수익률이 최저 법정 수익은 물론 위 1.5%에도 미치지 못하는 등 수익용 기본재산 관리를 소홀히 한 사실이 있고, - 위 법인의 이사회는 2018년 결산기준 수익용 기본재산 가액 329,792,020천원 중 50%에 상당하는 165,692,573천원을 유가증권에 투자하고도, ▷▷ 등 투자 (출자)...","※ 학교법인 대양학원 C, 투자회사의 사내이사 겸임 현황 투자회사 학교법인 대양학원 지분 ▷▷ 지분 급여 지급* 배당 가능이익 (’18.12.기준) 비고 ▷▷ 100%; ▽▽ 49% 51%; ’13∼’15년 사내이사 ◁◁ 37.4%; ; ; ; 76.21%; ; * 학교법인 대양학원은 투자회사별 급여한도, 급여총액, 1인당 평균 지급액만 제출(개인별 급여액은 개인정보라는 이유로 未제출) 【 붙임1 】 수익용기본재산 低수익 현황 (단위 : 천원) ※ 수익용기본재산 가액은 차년도 4월 신고 기준 회계연도 재산구분 재산가액 수입액 수익률(%) 법정 수익률(%) 2014 건물 2,066,246 188,636 9.13 토지 111,132,801 1,348,502 1.21 유가증권 176,255,581 300,000 0.17 예금 10,988,928…"
5,수익용기본재산(□□ 부지) 특수관계법인 계약 및 低價 임대 ◦,"- 학교법인 대양학원은 2017. 4. 서울 중구 충무로 소재 수익용기본재산 3개 필지 (토지) 합계 2,231㎡를 ▷▷ {학교법인 대양학원 100% 지분 보유, 학교법인 대양학원 C 사내 이사 겸임} 이 운영하는 □□ {▷▷ 소유} 부지로 빌려주면서, 기존 계약금액인 월 임대료 50,000천원 (보증금 150,000천원) 으로 임대 계약을 체결하여 2017회계연도 (2017.4.~2018.2.) 에 법정 수익률 확보 기준인 584,382천원 (공시지가의 1.48%) 보다 32,292천원이 적은 552,090천원만 (보증금 이자 포함) 지급받는 등【붙임】“수익용기본재...","【 붙임 】 수익용기본재산(토지) 低價 임대 현황 (단위 : 천원) 회계연도 공시지가 기준 임대료 (전년도 수신금리) 실제 임대수입 차액 임대료 보증금(150백만원) 이자수익 계 2017.4.~2018.2 (11개월) 43,074,862 584,382 (1.48%) 550,000 2,090 552,090 32,292 2018.3.~2019.2. (12개월) 48,429,536 755,500 (1.56%) 600,000 3,028 603,028 152,472 2019.3.~2019.5. (3개월) 48,429,536 226,408 (1.87%) 150,000 784 150,784 75,624 합계 - 1,566,290 1,300,000 5,902 1,305,902 260,388 감사결과 처분서 기관명 : 세종대학교"
6,교직원 임면 관련 소송비용 교비회계 집행 ◦,"- 세종대학교는 2014. 7. 23. 법인회계에서 집행하여야 할 교원 임면 관련 소송비 합계 163,700원을 교비회계에서 집행하는 등【붙임】“교직원 임면 관련 소송비용 교비 회계 집행 현황”과 같이 2014. 7.부터 2017. 5.까지 소송비 등 법인회계에서 집행하여야 할 총 8건 합계 15,080,760원을 교비회계에서 집행한","경고(4명) 【붙임】 교직원 임면 관련 소송비용 교비회계 집행 현황 (단위 : 원) 연 번 적요 지급처 교비회계 집행내역 법인회계 전출내역 일자 금액 일자 금액 1 행정소송 항소비용 지급 {교원소청위(-)} - 2014. 7. 23. 163,700 2017. 8. 4. 163,700 2 직원(-) 해임무효확인등 변호사 비용 지급(2014. 3 ~ 6월분) - 2014. 8. 6. 1,566,400 2017. 8. 4. 1,566,400 3 교원소청위 소송 3심 상고비용 지급(-) - 2015. 1. 21. 199,400 2017. 8. 4. 199,400 4 교원소청위 착수금 지급 (-) - 2016. 3. 23. 3,300,000 2017. 8. 4. 3,300,000 5 소송 결과 소송비용 지급 {- - (교원소청심사위원회)} - 201…"
7,B 개인 차량 기사 일당 법인회계 집행 ◦,"- 학교법인 대양학원은 2016. 2. 4. 업무결재를 위해 개인 차량으로 법인사무소에 출근한 B에게 운전기사 일당 명목으로 50천원을 지급하는 등 【붙임】“B 개인차량 운전기사 일당 법인회계 집행현황”과 같이 2016. 2.부터 2017. 8.까지 이사회 참석 또는 업무결재를 위해 개인 차량으로 출근한 B의 운전기사 일당 총 90회 합계 4,500천원을 법인회계 일반용역비에서 지급한","경고(6명); 시정(회수) - 학교법인과 고용 등 관계가 없는 B 개인차량 운전 기사 일당 명목 으로 지급한 합계 4,500천원을 B로 부터 회수하여 법인회계에 세입 조치하기 바람 【붙임】 B 개인차량 운전기사 일당 법인회계 지급현황 ( 단위 : 원 ) 연번 일자 지급 사유 지급액 1 2016. 3. 3. 2016. 2월 B 업무결재 운전기사 일당(5일) ·2016. 2. 4, 2. 15, 2. 19, 2. 25, 2. 29. 250,000 2 2016. 4. 18. 2016. 3월 B 업무결재 운전기사 일당(5일) ·2016. 3. 3, 3. 10, 3. 17, 3. 23, 3. 31. 250,000 3 2016. 5. 10. 2016. 4월 B 이사회 참석 및 업무결재 운전기사 일당(5일) ·2016. 4. 5, 4. 7, 4. 18,…"
8,업무추진비 집행 부당 ◦,"- 학교법인 대양학원 B은(는) 2016. 3. 4. 업무관련성을 입증할 사전품의 없이 서울시 종로구 소재 ◬◬ 에서 법인카드 (삼성카드, ****-****-****-****, 대양학원 B 전용 ) 로 77,000원을 결제하고 신용카드 영수증만 증빙자료로 첨부하여 업무추진비에서 집행하는 등【붙임1】“사용 목적 등 未명시 업무추진비 집행 내역”과 같이 2016. 3. 부터 2019. 4.까지 B은(는) 업무관련성을 입증할 사전 < ①, ② 관련> <고등교육정책실 별도조치>(1명) (4번에 포함조치) ◦ 시정(회수) - 해외에서 사적사용 한 법 인 카 드 사 용 액 6,...","통보 - 업무관련성 여부에 대한 검토 없이 집 행한 B 법인카드 사용 대금 합계 72,326,378원에 대 해 정산을 실시하 고, 업무와 무관하 게 사용한 금액은 B로부터 회수하여 법인회계에 세입 조치하기 바람 <별도조치>; 수사의뢰 < ② 관련>; 경고(2명) 【붙임1】 사용목적 등 未 명시 업무추진비 집행 내역 ( 단위 : 원 ) 연번 카드번호 사용일 사용 요일 사용 금액 사용업체 현황 업체명 업종 1 ****-****-****-**** 2016.03.04 금 77,000 ◬◬ 양식 2 ****-****-****-**** 2016.03.04 금 110,000 - 한식 3 ****-****-****-**** 2016.03.08 화 108,000 - 한식 4 ****-****-****-**** 2016.03.09 수 83,000 - 일식 5…"
9,예정가격 未 결정 입찰 실시 ◦,"- 학교법인 대양학원은 2017. 3. 24. ’예정가격‘을 결정하지 않고 “관수동 업무시설 신축공사 설계 용역 (‘17. 3. 6. 공고) ” 계약을 추진하면서 최저가격으로 입찰에 참여한 ◑◑ (대표자 F) 포함 입찰 참여 12개 업체 모두에 대하여 “예정가격 이하로 유찰” 통보한 사실이 있음 - 또한, 위 대양학원은 2017. 8. 14. “업무시설 (서울 종로구 ◦ 경고(1명) ◦ 통보(문책)(2명) 연 번 지 적 사 항 처 분 관수동 4필지, 경기 평택시 9필지) 신축공사 설계 용역 (‘17. 7. 19. 공고) ” 계약업체를 선정하면서 ’예정가격‘을 결정하지...","※ 입찰 참여업체 : ◒◒(투찰금액 233,170천원, 낙찰), ◓◓(투찰금액 264,000천원) 【참고】 설계용역 입찰 참여업체 유찰 현황 ( 단위 : 천원 ) 연번 입찰참여 업체 투찰 금액 (부가세 포함) 비고 1 - 85,000 “예정가격 이하로 유찰“ 통보 2 ◑◑ 55,000 3 - 59,950 4 - 65,274 5 - 68,200 6 - 69,300 7 - 70,950 8 - 73,480 9 - 83,477 10 - 105,600 11 - 135,300 12 - 149,600 감사결과 처분서 기관명 : 학교법인 대양학원"
10,"일반경쟁 입찰대상 용역 수의계약 체결 ◦ ｢ 사학기관 재무 ‧ 회계 규칙 ｣ 제4조에 따르면 법인과 학교의 재무와 회계는 건전하게 운영하여야 하고, 동 규칙 제35조 제1항에 따르면 예정가격이 ｢ 국가를 당 사자로 하는 계약에 관한 법률 시행령 ｣ 제26조 제1항 제5호의 규정에 의한 2천만원을 초과하는 용역계약을 체결하는 경우에는 일반경쟁에 부쳐야 한다고 되어 있는데도, - 학교법인 대양학원은 2016. 1. 15. 일반경쟁 입찰대상인 “파주 임대건물 종합관리 용역 (계약금액 49,980천원) “ 계약을 ▶▶ (대표자 G) 과 수의계약으로 체결하는 등","- 학교법인 대양학원은 2016. 1. 15. 일반경쟁 입찰대상인 “파주 임대건물 종합관리 용역 (계약금액 49,980천원) “ 계약을 ▶▶ (대표자 G) 과 수의계약으로 체결하는 등 【붙임】“일반경쟁 입찰대상 용역 수의계약 체결 현 황”과 같이 2016. 1.부터 2018. 2.까지 일반경쟁 입찰 대상인 용역 계약 2건 (계약금액 합계 84,300천원) 을 수의 계약으로 체결한","경고(4명) 【붙임】 일반경쟁입찰 대상 용역 수의계약 체결현황 ( 단위 : 천원 ) 연 번 계약일 계약건명 계약 구분 계약방식 계약 금액 (천원) 계약 상대방 법령상 실제 회사명 대표 1 2016. 1. 15. 파주 임대건물 건물종합관리 용역 일반경쟁 입찰 수의 49,980 ▶▶ G 2 2018. 2. 14. 법인 근로자 파견계약 용역 일반경쟁 입찰 수의 34,320 ▶▶ H 합계 84,300 감사결과 처분서 기관명 : 학교법인 대양학원"
11,"예산안 제출 및 심의·확정 기한 未 준수 ◦ 사학기관 재무·회계 규칙에 대한 특례규칙 제6조, 제7조, 제42조에 따르면 이사장은 법인회계의 예산안을 편성하여 매 회계연도 개시 50일전까지 이사회에 제출 하여야 하고, 이사회는 매 회계연도 개시 40일전까지 이를 심의·확정하여야 하도록 되어 있는데도, - 학교법인 대양학원은 2016. 1. 28. 법정 제출기한 (2016. 1. 9.) 을 도과하여 2016회계연도 법인회계 예산안을 이사회에 제출하는 등",- 학교법인 대양학원은 2016. 1. 28. 법정 제출기한 (2016. 1. 9.) 을 도과하여 2016회계연도 법인회계 예산안을 이사회에 제출하는 등【붙임】“예산안 이사회 제출 및 확정 기한 未준수 현황”과 같이 위 대양학원은 2016회계연도부터 2019회계연도까지 법정기한을 짧게는 18일 길게는 35일 도과하여 예산안을 이사회에 제출하거나 이사회에서 이를 심의·확정한,"기관경고 【붙임】 예산안 이사회 제출 및 확정 기한 未 준수 현황 회계 회계 연도 구분 이사회 제출 이사회 심의 ․ 확정 이사회 제출기한 이사회 제출일 도과 일수 이사회 심의 ․ 확정기한 이사회 심의 ․ 확정일 도과 일수 법인 회계 2016 예산 2016. 1 10. 2016. 1. 28. 18 2016. 1. 20. 2016. 2. 17. 28 2017 예산 2017. 1. 9. 2017. 2. 2. 24 2017. 1. 19. 2017. 2. 23. 35 2018 예산 2018. 1. 9. 2018. 2. 1. 23 2018. 1. 19. 2018. 2. 13. 25 2019 예산 2019. 1. 9. 2019. 1. 29. 20 2019. 1. 19. 2019. 2. 21. 33 감사결과 처분서 기관명 : 학교법인 대양학원, 세종대학교"
12,교원 채용과정 법인이사 참석 부당 ◦,"- 학교법인 대양학원 C은(는) 2013. 12. 16. 학교법인 임원의 직무에 속하지 않는 교원 ‘정년제 공개채용’ 면접 심사에 참석하여 총장과 나란히 앉아 지원자들에게 연구 【학교법인 대양학원】 <고등교육정책실 별도조치>(1명) (4번에 포함조치) 【세종대학교】 ◦ 경고(6명) ◦ 통보 - 법인 임원이 교직 원 면접 심사에 참 석하지 않도록 방 안 을 마 련 하 기 바 람 연 번 지 적 사 항 처분 분야, 취미, 개인 신상 등에 대한 질문을 하는 등 교원 채용과정에 관여한 사실이 있고 · 나아가, C은(는) 면접심사 후 추천순위 결정을 위한 심사위원간 협의과정에도...","- 또한, 세종대학교는 2013. 12. 16.부터 2019. 1.까지 위 C이(가) 위 ‘정년제 공개채용’ 건 등 61회 (추정) 에 걸쳐 학교법인 임원의 직무와 무관한 교원 신규채용 면접 심사에 참석하는데도 아무런 조치를 취하지 않은 사 실이 있음 【붙임】 법인이사 교직원 면접심사 참석 현황 연번 구분 연도 건명 면접심사일자 면접장소 1 교원 2013 정년제 공개채용 2013.12.16 세종사이버대 주몽관 2 2013.12.24 3 2013.12.26 4 2013.12.27 5 2014 정년제 특별채용 2014.1.27 6 정년제 공개채용 2014.4.28 7 2014.4.29. 8 정년제 공개채용 2014.12.18. 9 2014.12.19. 10 2014.12.22. 11 2015 정년제 특별채용 2015.1.21 12 정년제 공개채…"
13,총장 징계절차 未 이행 ◦,"- 학교법인 대양학원은 2018. 5. 29. 서울중앙지방검찰청 으로부터 세종대학교 I가 ‘업무상 횡령’으로 불구속기소 (서울중앙지방법원, 2018고단****) 되었다는 사실을 통보받아 위 I가 직무상의 의무를 위반한 사실을 ‘2018년도 제4차 이사회 (‘18.6.15.) ’에서 보고 받고도 2019. 5. 감사일 현재 까지 교원징계위원회에 징계의결을 요구하지 않은 사 실이 있음 ◦ 경고(8명) ◦ 통보 - 형사사건으로 기소 된 I에 대 하 여 관 련규정에 따 라 조 치 하 기 바 람 【 참고 】 범죄처분자 징계의결 未 요구 현황 소속 성명 (직급) 범죄사실 통보...","총장 징계절차 未 이행; 「고등교육법」제14조 제2항에 따르면 학교에 두는 교원은 총장이나 학장 외에 교수·부교수·조교수 및 강사로 구분한다고 되어 있고,「사립학교법」제16조 및「학교 법인 대양학원 정관 (’18.4.26.) 」제31조에 따르면 이사 회는 법인이 설치한 학교의 장 및 교원의 임용에 관한 사항을 심의·결정한다고 되어 있고,「사립학교법 제61조 제1항 및 제64조에 따르면 교원의 임용권자는 사립학교의 교원이 사립학교법과 기타 교육관계 법령에 위반하여 교원의 본분에 배치되는 행위를 한 때, 직무상의 의무에 위반하거나 직무를 태만히 한 때, 직무의 내외를 불문 하고 교원으로서의 품위를 손상하는 행위를 한 때에는 교원징계위원회에 그 징계의결을 요구하여야 한다고 되어 있는데도, - 학교법인 대양학원은 2018. 5. 29. 서울중앙지방…"
14,교원 신규채용 공고 부적정 ◦,- 세종대학교는 2016. 7. 25. ‘2016. 2학기 연구중점 비정년제 전임교원’을 공개채용하면서 채용공고에 채용인원을 명시하지 않는 등 【 붙임】“교원 신규채용 공고 부적정 현황”과 같이 2016. 7.부터 2019. 5. 감사일 현재까지 위 채용 건 등 총 21회의 채용공고시 채용인원을 명시 하지 않은,경고(4명); 통보 - 향후 교원 신규 채용시 채용인원 명시 등 관련규정 에 따라 채용공고 가 이루어질 수 있도록 하기 바람 【 붙임 】 교원 신규채용 공고 부적정 현황 연번 건 명 채용인원 1 2016-2학기 교수초빙 공고(연구중점 비정년제 전임교원) 미기재 2 2016-2학기 교수초빙 공고(정년제 전임교원) 미기재 3 2016-2학기 교수초빙 공고(정년제 전임교원) 미기재 4 2017-1학기 연구중점 비정년제 전임교원 교수 초빙 공고 미기재 5 2017-1학기 교수초빙 공고(정년제 전임교원) 미기재 6 2017-1학기 강의중점 비정년제 전임교원 교수 초빙 공고 미기재 7 2017-1학기 교수초빙(산학협력중점 비정년제 전임교원) 공고 미기재 8 2017-1학기 연구중점 비정년제 전임교원 교수 초빙 공고 미기재 9 2017-2학기 강의중점…
15,산학협력단 소관 연구원 4대보험 기관부담금 교비회계 집행 ◦,"- 세종대학교는 2016. 3. 교육부 지원사업인 BK+21 ‘나노 기술기반 유무기하이브리드 물질연구 (4차년도) ’ 과제를 수행하기 위해 연구비 등 산학협력단 재원에서 급여를 지급하는 조건으로 채용한 연구전담인력 J의 급여를 지급 하면서 국민연금 등 기관부담금 합계 126,630원을 교 비회계에서 부담하는 등【붙임】“산학협력단 소관 연 구원 4대보험 기관부담금 교비회계 집행 현황”과 같이 2016. 3.부터 2018. 8.까지 연구비 등 산학협력단 재원 에서 급여를 지급하는 조건으로 채용한 국가연구개발 사업 및 학술지원사업 연구전담인력 144명의 급여를 지급 하면서...",".; 경고(3명); 시정 - 교비회계에서 부담 한 국 고 사 업 인 건 비 기관부담금 합계 283,221,984원을 산학협력단회계 에서 교비회계로 전출하기 바람"
16,교비회계 예산 초과집행 ◦,"- 세종대학교는 2016회계연도에 등록금회계 교원퇴직금 계정과목에서 예산 (420,360천원) 대비 111,480천원을 초과 하여 자금을 집행하는 등【붙임】“교비회계 예산 초과 집행 현황”과 같이 2016회계연도부터 2018회계연도까지 등록금회계 및 비등록금회계 총 37개 계정과목에서 예산대비 적게는 128천원, 많게는 1,296,856천원 합계 6,386,329천원을 초과하여 자금을 집행한",".; 경고(9명) 【 붙임 】 교비회계 예산 초과집행 현황 (단위 : 천원) 연 번 계정과목 회계 연도 등록금회계 비등록금회계 초과집행액 합계 예산 결산 초과집행 예산 결산 초과집행 1 교원퇴직금 2016 420,360 531,840 111,480 111,480 2017 582,335 710,551 128,216 69,888 104,394 34,506 162,722 2018 291,956 323,969 32,013 33,227 114,401 81,174 113,187 2 교원각종수당 2017 173,218 176,498 3,280 3 조교인건비 2017 308,518 313,359 4,841 2018 290,690 290,818 128 4 직원급여 2016 856,091 857,809 1,718 5 직원각종수당 2016 86,842 90,4…"
17,일반경쟁 입찰대상 수의계약 체결 ◦,"- 세종대학교는 2016. 2. 1. 예정가격이 56,000,000천원인 ‘◘◘ 신축공사’에 대한 입찰결과 예정가격 이하로 입찰한 업체가 없어 유찰된 후 2016. 2. 19. 재공고 입찰 에서도 같은 사유로 유찰되자 예정가격을 높여 경쟁 입찰에 부치는 등 조치 없이 2016. 5. 24. 위 공사를 ◙◙ (대표 K) 와 예정가격을 4,400,000천원 초과한 60,400,000 ◦ 경징계(2명) ◦ 경고(5명) ◦ 통보(문책)(3명) <별도조치> ◦ 수사의뢰 연 번 지 적 사 항 처 분 천원에 수의계약하는 등【붙임】“일반경쟁입찰 대상 수의 계약 체결 현황”과 같이...",". 【 붙임 】 일반경쟁입찰 대상 수의계약 체결 현황 (단위 : 천원) 연번 계약건명 예정가격 입찰일 (결과) 수의계약일 계약금액 (예가초과액) 계약업체 (대표자) 비고 ( 관련자 ) 1 ◘◘ 신축공사 56,000,000 최초_2016.02.01. (유찰) 재공고_2016.02.19. (유찰) 2016.05.24. 60,400,000 (4,400,000) ◙◙ (K) 188,000 최초_2018.09.05. (유찰) 재공고_2018.09.11. (유찰) 2018.10.01. 190,080 (2,080) - 80,000 최초_2018.09.05. (유찰) 재공고_2018.09.11. (유찰) 2018.10.01. 84,100 (4,100) - 116,500 최초_2019.02.14. (유찰) 재공고_2019.02.19. (유찰) 2019.03…"
18,기술지주회사 자회사 관리 부적정 ◦,"- 세종대학교 산학협력단은 ‘세종대학교 기술지주 주식회사’ 자회사인 ‘ ▼▼ (대표 L) ’가 보유한 특허**를 사업화하지 못한 채 세종대학교 정보시스템유지보수, 산학협력단 ◦ 경고(1명) ◦ 통보 - ▼▼의 재무건전 성을 확보하기 위한 방안을 강구 하고, - L이 사적으로 사 용한 법인카드 비용에 대해 회수 등 적의 조치하기 바람 연 번 지 적 사 항 처 분 문서전산화 구축 등을 주된 사업으로 하면서【붙임 1】 “ ▼▼ 재무현황”과 같이 2017년 및 2018년에 총 54,049 천원의 적자가 발생하는 등 2018년 결산 기준 손실누적 액이 81,872천원에 이르게...","※ 사용액 1,511천원은 접대비로 회계처리 【 붙임 1 】 ▼▼ 재무현황 (단위 : 천원) 투자원금 손실 및 투자금 잔액 비고 (경상비 지출) 2017 2018 2017 2018 투자원금 기타 투자원금 합계 누적 손실액 투자금 잔액 누적 손실액 투자금 잔액 접대비 여비 교통비 접대비 여비 교통비 58,000 42,000 100,000 69,296 30,704 81,872 18,128 8,215 5,436 23,994 12,509 ※ ① 117,000천원 상당 특허권(현물) 별도 출자 ② ‘17～’18 손실액 합계 54,049천원 【 붙임 2 】 회사 법인카드 사적사용 현황 (단위 : 천원) 연번 사용일 사용처 사용액 1 2018.04.20. ◧◧ 800 2 2018.08.11. - 165 3 2018.11.01. - 177 4 2018.1…"
19,관리업무수당 지급 부당 ◦,"- 세종대학교 M은 2015. 7. 관리업무수당 지급 업무를 담당하는 부하 직원 N에게 O에 대한 관리업무수당을 매월 450,000원을 지급하라고 지시하고, 그에 따라 위 N은 2015. 7.부터 2018. 7.까지 보수규정과 다르게 위 O에게 관리업무수당 합계 5,550천원 (37개월×150천원) 을 더 지급한","경고(1명); 통보(문책)(1명); 시정(회수) - 과다 지 급된 관 리업 무 수당 합계 5,550천원 을 O로부터 회수하 여 교비 회계에 세 입조치하기 바람 감사결과 처분서 기관명 : 세종대학교"
